cart_id,cart_total,cart_discounted_total,user_id,cart_total_products,cart_total_quantity,product_id,product_quantity,product_total,discount_percentage,product_discounted_total,thumbnail,product_name,description,category,product_price,discountPercentage,rating,stock,brand,sku,weight_product,warrantyInformation,shippingInformation,availabilityStatus,returnPolicy,minimumOrderQuantity,firstName,lastName,age,gender,email,phone,username,height,weight_user,university,role
47,50539.87,49199.91,47,5,13,164,4,139.96,14.28,119.97,https://cdn.dummyjson.com/product-images/tops/gray-dress/thumbnail.webp,Gray Dress,"The Gray Dress is a versatile and chic option for various occasions. With a neutral gray color, it can be dressed up or down, making it a wardrobe staple for any fashion-forward individual.",tops,34.99,14.28,2.72,55,,TOP-BRD-GRA-164,1,1 month warranty,Ships in 1 month,In Stock,90 days return policy,13,Nicholas,Bailey,36,male,nicholas.bailey@x.dummyjson.com,+49 212-856-4272,nicholasb,162.29,50.86,Yale University,user
47,50539.87,49199.91,47,5,13,169,2,49999.98,2.63,48684.98,https://cdn.dummyjson.com/product-images/vehicle/dodge-hornet-gt-plus/thumbnail.webp,Dodge Hornet GT Plus,"The Dodge Hornet GT Plus is a compact and agile hatchback, perfect for urban driving with a touch of sportiness.",vehicle,24999.99,2.63,2.65,82,Dodge,VEH-DOD-DOD-169,8,1 year warranty,Ships in 1 month,In Stock,60 days return policy,1,Nicholas,Bailey,36,male,nicholas.bailey@x.dummyjson.com,+49 212-856-4272,nicholasb,162.29,50.86,Yale University,user
47,50539.87,49199.91,47,5,13,92,2,219.98,0.04,219.89,https://cdn.dummyjson.com/product-images/mens-shoes/sports-sneakers-off-white-red/thumbnail.webp,Sports Sneakers Off White Red,"Another variant of the Sports Sneakers in Off White Red, featuring a unique design. These sneakers offer style and comfort for casual occasions.",mens-shoes,109.99,0.04,4.69,62,Off White,MEN-OFF-SPO-092,9,3 months warranty,Ships overnight,In Stock,60 days return policy,3,Nicholas,Bailey,36,male,nicholas.bailey@x.dummyjson.com,+49 212-856-4272,nicholasb,162.29,50.86,Yale University,user
47,50539.87,49199.91,47,5,13,46,2,29.98,6.84,27.93,https://cdn.dummyjson.com/product-images/home-decoration/plant-pot/thumbnail.webp,Plant Pot,"The Plant Pot is a stylish container for your favorite plants. With a sleek design, it complements your indoor or outdoor garden, adding a modern touch to your plant display.",home-decoration,14.99,6.84,3.01,59,,HOM-BRD-PLA-046,9,Lifetime warranty,Ships in 3-5 business days,In Stock,30 days return policy,31,Nicholas,Bailey,36,male,nicholas.bailey@x.dummyjson.com,+49 212-856-4272,nicholasb,162.29,50.86,Yale University,user
48,110.91,101.89,48,2,9,140,5,74.95,7.44,69.37,https://cdn.dummyjson.com/product-images/sports-accessories/basketball/thumbnail.webp,Basketball,"The Basketball is a standard ball used in basketball games. It is designed for dribbling, shooting, and passing in the game of basketball, suitable for both indoor and outdoor play.",sports-accessories,14.99,7.44,4.66,75,,SPO-BRD-BAS-140,7,1 year warranty,Ships in 1 week,In Stock,90 days return policy,11,Luna,Russell,28,female,luna.russell@x.dummyjson.com,+91 730-486-3735,lunar,188.0,76.37,University of Florida,user
48,110.91,101.89,48,2,9,18,4,35.96,9.58,32.52,https://cdn.dummyjson.com/product-images/groceries/cat-food/thumbnail.webp,Cat Food,Nutritious cat food formulated to meet the dietary needs of your feline friend.,groceries,8.99,9.58,3.13,46,,GRO-BRD-FOO-018,10,1 year warranty,Ships overnight,In Stock,No return policy,18,Luna,Russell,28,female,luna.russell@x.dummyjson.com,+91 730-486-3735,lunar,188.0,76.37,University of Florida,user
49,4208.81,3843.75,49,5,19,184,5,99.94999999999999,0.76,99.19,https://cdn.dummyjson.com/product-images/womens-jewellery/tropical-earring/thumbnail.webp,Tropical Earring,"The Tropical Earring is a fun and playful accessory inspired by tropical elements. Featuring vibrant colors and a lively design, it's perfect for adding a touch of summer to your look.",womens-jewellery,19.99,0.76,4.4,1,,WOM-BRD-TRO-184,3,3 year warranty,Ships in 1-2 business days,Low Stock,7 days return policy,31,Jacob,Cooper,32,male,jacob.cooper@x.dummyjson.com,+91 322-775-7582,jacobc,157.39,96.32,University of California--Los Angeles (UCLA),user
49,4208.81,3843.75,49,5,19,142,5,64.95,8.63,59.34,https://cdn.dummyjson.com/product-images/sports-accessories/cricket-ball/thumbnail.webp,Cricket Ball,"The Cricket Ball is a hard leather ball used in the sport of cricket. It is bowled and batted in the game, and its hardness and seam contribute to the dynamics of cricket play.",sports-accessories,12.99,8.63,3.53,30,,SPO-BRD-CRI-142,7,3 year warranty,Ships in 3-5 business days,In Stock,7 days return policy,11,Jacob,Cooper,32,male,jacob.cooper@x.dummyjson.com,+91 322-775-7582,jacobc,157.39,96.32,University of California--Los Angeles (UCLA),user
49,4208.81,3843.75,49,5,19,15,5,3999.95,8.8,3647.95,https://cdn.dummyjson.com/product-images/furniture/wooden-bathroom-sink-with-mirror/thumbnail.webp,Wooden Bathroom Sink With Mirror,"The Wooden Bathroom Sink with Mirror is a unique and stylish addition to your bathroom, featuring a wooden sink countertop and a matching mirror.",furniture,799.99,8.8,3.59,7,Bath Trends,FUR-BAT-WOO-015,10,3 year warranty,Ships in 3-5 business days,Low Stock,60 days return policy,2,Jacob,Cooper,32,male,jacob.cooper@x.dummyjson.com,+91 322-775-7582,jacobc,157.39,96.32,University of California--Los Angeles (UCLA),user
49,4208.81,3843.75,49,5,19,18,2,17.98,9.58,16.26,https://cdn.dummyjson.com/product-images/groceries/cat-food/thumbnail.webp,Cat Food,Nutritious cat food formulated to meet the dietary needs of your feline friend.,groceries,8.99,9.58,3.13,46,,GRO-BRD-FOO-018,10,1 year warranty,Ships overnight,In Stock,No return policy,18,Jacob,Cooper,32,male,jacob.cooper@x.dummyjson.com,+91 322-775-7582,jacobc,157.39,96.32,University of California--Los Angeles (UCLA),user
49,4208.81,3843.75,49,5,19,111,2,25.98,19.12,21.01,https://cdn.dummyjson.com/product-images/mobile-accessories/selfie-stick-monopod/thumbnail.webp,Selfie Stick Monopod,The Selfie Stick Monopod is a extendable and foldable device for capturing the perfect selfie or group photo. Compatible with smartphones and cameras.,mobile-accessories,12.99,19.12,3.88,11,SnapTech,MOB-SNA-SEL-111,2,3 year warranty,Ships in 1-2 business days,In Stock,30 days return policy,8,Jacob,Cooper,32,male,jacob.cooper@x.dummyjson.com,+91 322-775-7582,jacobc,157.39,96.32,University of California--Los Angeles (UCLA),user
50,13144.93,10852.12,50,3,7,60,5,54.95,3.56,52.99,https://cdn.dummyjson.com/product-images/kitchen-accessories/grater-black/thumbnail.webp,Grater Black,"The Grater in Black is a handy kitchen tool for grating cheese, vegetables, and more. Its sleek design and sharp blades make food preparation efficient and easy.",kitchen-accessories,10.99,3.56,3.21,84,,KIT-BRD-GRA-060,3,1 month warranty,Ships in 1 week,In Stock,60 days return policy,5,Stella,Hughes,34,female,stella.hughes@x.dummyjson.com,+92 378-326-3439,stellah,171.2,81.45,University of California--San Diego,user
50,13144.93,10852.12,50,3,7,96,1,12999.99,17.52,10722.39,https://cdn.dummyjson.com/product-images/mens-watches/rolex-cellini-moonphase/thumbnail.webp,Rolex Cellini Moonphase,"The Rolex Cellini Moonphase is a masterpiece of horology, featuring a moon phase complication and exquisite design. It reflects Rolex's commitment to precision and elegance.",mens-watches,12999.99,17.52,2.58,36,Rolex,MEN-ROL-ROL-096,2,6 months warranty,Ships overnight,In Stock,7 days return policy,1,Stella,Hughes,34,female,stella.hughes@x.dummyjson.com,+92 378-326-3439,stellah,171.2,81.45,University of California--San Diego,user
50,13144.93,10852.12,50,3,7,8,1,89.99,14.72,76.74,https://cdn.dummyjson.com/product-images/fragrances/dior-j'adore/thumbnail.webp,Dior J'adore,"J'adore by Dior is a luxurious and floral fragrance, known for its blend of ylang-ylang, rose, and jasmine. It embodies femininity and sophistication.",fragrances,89.99,14.72,3.8,98,Dior,FRA-DIO-DIO-008,4,1 week warranty,Ships in 2 weeks,In Stock,7 days return policy,10,Stella,Hughes,34,female,stella.hughes@x.dummyjson.com,+92 378-326-3439,stellah,171.2,81.45,University of California--San Diego,user
51,36519.9,32961.03,51,5,10,133,5,3499.95,5.59,3304.3,https://cdn.dummyjson.com/product-images/smartphones/samsung-galaxy-s10/thumbnail.webp,Samsung Galaxy S10,"The Samsung Galaxy S10 is a flagship device featuring a dynamic AMOLED display, versatile camera system, and powerful performance. It represents innovation and excellence in smartphone technology.",smartphones,699.99,5.59,3.06,19,Samsung,SMA-SAM-SAM-133,9,No warranty,Ships in 2 weeks,In Stock,30 days return policy,2,Eli,Bennett,30,male,eli.bennett@x.dummyjson.com,+1 465-379-7226,elib,170.61,91.22,Boston University,user
51,36519.9,32961.03,51,5,10,73,1,19.99,12.09,17.57,https://cdn.dummyjson.com/product-images/kitchen-accessories/spice-rack/thumbnail.webp,Spice Rack,The Spice Rack is a convenient organizer for your spices and seasonings. Keep your kitchen essentials within reach and neatly arranged with this stylish spice rack.,kitchen-accessories,19.99,12.09,4.87,79,,KIT-BRD-SPI-073,7,1 week warranty,Ships overnight,In Stock,7 days return policy,18,Eli,Bennett,30,male,eli.bennett@x.dummyjson.com,+1 465-379-7226,elib,170.61,91.22,Boston University,user
51,36519.9,32961.03,51,5,10,96,1,12999.99,17.52,10722.39,https://cdn.dummyjson.com/product-images/mens-watches/rolex-cellini-moonphase/thumbnail.webp,Rolex Cellini Moonphase,"The Rolex Cellini Moonphase is a masterpiece of horology, featuring a moon phase complication and exquisite design. It reflects Rolex's commitment to precision and elegance.",mens-watches,12999.99,17.52,2.58,36,Rolex,MEN-ROL-ROL-096,2,6 months warranty,Ships overnight,In Stock,7 days return policy,1,Eli,Bennett,30,male,eli.bennett@x.dummyjson.com,+1 465-379-7226,elib,170.61,91.22,Boston University,user
51,36519.9,32961.03,51,5,10,98,1,13999.99,5.05,13292.99,https://cdn.dummyjson.com/product-images/mens-watches/rolex-submariner-watch/thumbnail.webp,Rolex Submariner Watch,"The Rolex Submariner is a legendary dive watch with a rich history. Known for its durability and water resistance, it's a symbol of adventure and exploration.",mens-watches,13999.99,5.05,2.69,55,Rolex,MEN-ROL-ROL-098,4,5 year warranty,Ships in 1 month,In Stock,90 days return policy,1,Eli,Bennett,30,male,eli.bennett@x.dummyjson.com,+1 465-379-7226,elib,170.61,91.22,Boston University,user
51,36519.9,32961.03,51,5,10,116,2,5999.98,6.27,5623.78,https://cdn.dummyjson.com/product-images/motorcycle/scooter-motorcycle/thumbnail.webp,Scooter Motorcycle,The Scooter Motorcycle is a practical and fuel-efficient bike ideal for urban commuting. It features a step-through design and user-friendly controls for easy maneuverability.,motorcycle,2999.99,6.27,2.53,84,ScootMaster,MOT-SCO-SCO-116,7,5 year warranty,Ships overnight,In Stock,7 days return policy,1,Eli,Bennett,30,male,eli.bennett@x.dummyjson.com,+1 465-379-7226,elib,170.61,91.22,Boston University,user
52,134382.82,130175.28,52,6,18,169,5,124999.95000000001,2.63,121712.45,https://cdn.dummyjson.com/product-images/vehicle/dodge-hornet-gt-plus/thumbnail.webp,Dodge Hornet GT Plus,"The Dodge Hornet GT Plus is a compact and agile hatchback, perfect for urban driving with a touch of sportiness.",vehicle,24999.99,2.63,2.65,82,Dodge,VEH-DOD-DOD-169,8,1 year warranty,Ships in 1 month,In Stock,60 days return policy,1,Grace,Perry,27,female,grace.perry@x.dummyjson.com,+49 550-430-8269,gracep,193.34,81.7,Boston College,user
52,134382.82,130175.28,52,6,18,194,2,259.98,12.6,227.22,https://cdn.dummyjson.com/product-images/womens-watches/women's-wrist-watch/thumbnail.webp,Women's Wrist Watch,"The Women's Wrist Watch is a versatile and fashionable timepiece for everyday wear. With a comfortable strap and a simple yet elegant design, it complements various styles.",womens-watches,129.99,12.6,3.52,12,Fashion Co.,WOM-FAS-WOM-194,1,1 year warranty,Ships in 2 weeks,In Stock,No return policy,5,Grace,Perry,27,female,grace.perry@x.dummyjson.com,+49 550-430-8269,gracep,193.34,81.7,Boston College,user
52,134382.82,130175.28,52,6,18,4,1,12.99,12.16,11.41,https://cdn.dummyjson.com/product-images/beauty/red-lipstick/thumbnail.webp,Red Lipstick,"The Red Lipstick is a classic and bold choice for adding a pop of color to your lips. With a creamy and pigmented formula, it provides a vibrant and long-lasting finish.",beauty,12.99,12.16,4.36,91,Chic Cosmetics,BEA-CHI-LIP-004,1,3 year warranty,Ships in 1 week,In Stock,7 days return policy,40,Grace,Perry,27,female,grace.perry@x.dummyjson.com,+49 550-430-8269,gracep,193.34,81.7,Boston College,user
52,134382.82,130175.28,52,6,18,114,1,8999.99,9.77,8120.69,https://cdn.dummyjson.com/product-images/motorcycle/kawasaki-z800/thumbnail.webp,Kawasaki Z800,"The Kawasaki Z800 is a powerful and agile sportbike known for its striking design and performance. It's equipped with advanced features, making it a favorite among motorcycle enthusiasts.",motorcycle,8999.99,9.77,3.98,52,Kawasaki,MOT-KAW-KAW-114,9,Lifetime warranty,Ships in 3-5 business days,In Stock,90 days return policy,1,Grace,Perry,27,female,grace.perry@x.dummyjson.com,+49 550-430-8269,gracep,193.34,81.7,Boston College,user
52,134382.82,130175.28,52,6,18,77,5,29.950000000000003,12.48,26.21,https://cdn.dummyjson.com/product-images/kitchen-accessories/yellow-peeler/thumbnail.webp,Yellow Peeler,The Yellow Peeler is a handy tool for peeling fruits and vegetables with ease. Its bright yellow color adds a cheerful touch to your kitchen gadgets.,kitchen-accessories,5.99,12.48,4.24,35,,KIT-BRD-YEL-077,7,1 month warranty,Ships in 3-5 business days,In Stock,90 days return policy,6,Grace,Perry,27,female,grace.perry@x.dummyjson.com,+49 550-430-8269,gracep,193.34,81.7,Boston College,user
52,134382.82,130175.28,52,6,18,185,4,79.96,3.33,77.3,https://cdn.dummyjson.com/product-images/womens-shoes/black-&-brown-slipper/thumbnail.webp,Black & Brown Slipper,"The Black & Brown Slipper is a comfortable and stylish choice for casual wear. Featuring a blend of black and brown colors, it adds a touch of sophistication to your relaxation.",womens-shoes,19.99,3.33,2.53,3,Comfort Trends,WOM-COM-BLA-185,5,Lifetime warranty,Ships in 1 month,Low Stock,60 days return policy,47,Grace,Perry,27,female,grace.perry@x.dummyjson.com,+49 550-430-8269,gracep,193.34,81.7,Boston College,user
53,1079.94,1028.19,53,2,6,159,2,999.98,3.64,963.58,https://cdn.dummyjson.com/product-images/tablets/ipad-mini-2021-starlight/thumbnail.webp,iPad Mini 2021 Starlight,"The iPad Mini 2021 in Starlight is a compact and powerful tablet from Apple. Featuring a stunning Retina display, powerful A-series chip, and a sleek design, it offers a premium tablet experience.",tablets,499.99,3.64,3.18,47,Apple,TAB-APP-IPA-159,5,2 year warranty,Ships in 1-2 business days,In Stock,No return policy,3,Lucas,Gordon,36,male,lucas.gordon@x.dummyjson.com,+81 367-320-4960,lucasgx,179.73,72.92,Massachusetts Institute of Technology (MIT),user
53,1079.94,1028.19,53,2,6,163,4,79.96,19.2,64.61,https://cdn.dummyjson.com/product-images/tops/girl-summer-dress/thumbnail.webp,Girl Summer Dress,"The Girl Summer Dress is a cute and breezy dress designed for warm weather. With playful patterns and lightweight fabric, it's perfect for keeping cool and stylish during the summer.",tops,19.99,19.2,4.77,43,,TOP-BRD-GIR-163,5,Lifetime warranty,Ships in 1 month,In Stock,60 days return policy,46,Lucas,Gordon,36,male,lucas.gordon@x.dummyjson.com,+81 367-320-4960,lucasgx,179.73,72.92,Massachusetts Institute of Technology (MIT),user
54,10999.95,9998.55,54,2,5,12,2,4999.98,14.4,4279.98,https://cdn.dummyjson.com/product-images/furniture/annibale-colombo-sofa/thumbnail.webp,Annibale Colombo Sofa,"The Annibale Colombo Sofa is a sophisticated and comfortable seating option, featuring exquisite design and premium upholstery for your living room.",furniture,2499.99,14.4,3.92,60,Annibale Colombo,FUR-ANN-ANN-012,6,Lifetime warranty,Ships in 1 week,In Stock,7 days return policy,1,Ava,Harrison,29,female,ava.harrison@x.dummyjson.com,+44 926-778-4653,avah,155.72,93.47,Harvard University,user
54,10999.95,9998.55,54,2,5,78,3,5999.97,4.69,5718.57,https://cdn.dummyjson.com/product-images/laptops/apple-macbook-pro-14-inch-space-grey/thumbnail.webp,Apple MacBook Pro 14 Inch Space Grey,"The MacBook Pro 14 Inch in Space Grey is a powerful and sleek laptop, featuring Apple's M1 Pro chip for exceptional performance and a stunning Retina display.",laptops,1999.99,4.69,3.65,24,Apple,LAP-APP-APP-078,9,3 year warranty,Ships in 2 weeks,In Stock,90 days return policy,1,Ava,Harrison,29,female,ava.harrison@x.dummyjson.com,+44 926-778-4653,avah,155.72,93.47,Harvard University,user
55,42.96,39.92,55,2,4,49,3,17.97,15.65,15.16,https://cdn.dummyjson.com/product-images/kitchen-accessories/black-aluminium-cup/thumbnail.webp,Black Aluminium Cup,The Black Aluminium Cup is a stylish and durable cup suitable for both hot and cold beverages. Its sleek black design adds a modern touch to your drinkware collection.,kitchen-accessories,5.99,15.65,4.46,75,,KIT-BRD-BLA-049,7,1 year warranty,Ships overnight,In Stock,30 days return policy,48,Owen,Fisher,32,male,owen.fisher@x.dummyjson.com,+49 328-635-8057,owenf,167.31,72.03,University of Wisconsin--Madison,user
55,42.96,39.92,55,2,4,84,1,24.99,0.94,24.76,https://cdn.dummyjson.com/product-images/mens-shirts/gigabyte-aorus-men-tshirt/thumbnail.webp,Gigabyte Aorus Men Tshirt,"The Gigabyte Aorus Men Tshirt is a cool and casual shirt for gaming enthusiasts. With the Aorus logo and sleek design, it's perfect for expressing your gaming style.",mens-shirts,24.99,0.94,3.18,90,Gigabyte,MEN-GIG-GIG-084,4,3 year warranty,Ships overnight,In Stock,30 days return policy,16,Owen,Fisher,32,male,owen.fisher@x.dummyjson.com,+49 328-635-8057,owenf,167.31,72.03,University of Wisconsin--Madison,user
56,121.97,109.12,56,2,3,60,2,21.98,3.56,21.2,https://cdn.dummyjson.com/product-images/kitchen-accessories/grater-black/thumbnail.webp,Grater Black,"The Grater in Black is a handy kitchen tool for grating cheese, vegetables, and more. Its sleek design and sharp blades make food preparation efficient and easy.",kitchen-accessories,10.99,3.56,3.21,84,,KIT-BRD-GRA-060,3,1 month warranty,Ships in 1 week,In Stock,60 days return policy,5,Samantha,Howard,31,female,samantha.howard@x.dummyjson.com,+91 458-289-9756,samanthah,183.61,81.47,University of Rochester,user
56,121.97,109.12,56,2,3,99,1,99.99,12.07,87.92,https://cdn.dummyjson.com/product-images/mobile-accessories/amazon-echo-plus/thumbnail.webp,Amazon Echo Plus,The Amazon Echo Plus is a smart speaker with built-in Alexa voice control. It features premium sound quality and serves as a hub for controlling smart home devices.,mobile-accessories,99.99,12.07,4.99,61,Amazon,MOB-AMA-AMA-099,5,6 months warranty,Ships in 1 week,In Stock,7 days return policy,9,Samantha,Howard,31,female,samantha.howard@x.dummyjson.com,+91 458-289-9756,samanthah,183.61,81.47,University of Rochester,user
57,1269.91,1158.21,57,2,9,88,5,749.95,4.12,719.05,https://cdn.dummyjson.com/product-images/mens-shoes/nike-air-jordan-1-red-and-black/thumbnail.webp,Nike Air Jordan 1 Red And Black,"The Nike Air Jordan 1 in Red and Black is an iconic basketball sneaker known for its stylish design and high-performance features, making it a favorite among sneaker enthusiasts and athletes.",mens-shoes,149.99,4.12,4.77,7,Nike,MEN-NIK-NIK-088,3,1 year warranty,Ships in 1 week,In Stock,No return policy,1,Nathan,Dixon,35,male,nathan.dixon@x.dummyjson.com,+44 540-488-4436,nathand,166.43,59.96,University of Wisconsin--Madison,user
57,1269.91,1158.21,57,2,9,100,4,519.96,15.54,439.16,https://cdn.dummyjson.com/product-images/mobile-accessories/apple-airpods/thumbnail.webp,Apple Airpods,"The Apple Airpods offer a seamless wireless audio experience. With easy pairing, high-quality sound, and Siri integration, they are perfect for on-the-go listening.",mobile-accessories,129.99,15.54,4.15,67,Apple,MOB-APP-APP-100,4,3 year warranty,Ships in 3-5 business days,In Stock,No return policy,4,Nathan,Dixon,35,male,nathan.dixon@x.dummyjson.com,+44 540-488-4436,nathand,166.43,59.96,University of Wisconsin--Madison,user
58,1212.97,1042.77,58,2,3,174,2,1199.98,14.09,1030.9,https://cdn.dummyjson.com/product-images/womens-bags/prada-women-bag/thumbnail.webp,Prada Women Bag,"The Prada Women Bag is an iconic designer bag that exudes elegance and luxury. Crafted with precision and featuring the Prada logo, it's a statement piece for fashion enthusiasts.",womens-bags,599.99,14.09,2.71,75,Prada,WOM-PRA-PRA-174,4,3 year warranty,Ships in 1-2 business days,In Stock,60 days return policy,1,Bella,Grant,28,female,bella.grant@x.dummyjson.com,+92 896-206-1901,bellag,192.65,96.46,Vanderbilt University,user
58,1212.97,1042.77,58,2,3,142,1,12.99,8.63,11.87,https://cdn.dummyjson.com/product-images/sports-accessories/cricket-ball/thumbnail.webp,Cricket Ball,"The Cricket Ball is a hard leather ball used in the sport of cricket. It is bowled and batted in the game, and its hardness and seam contribute to the dynamics of cricket play.",sports-accessories,12.99,8.63,3.53,30,,SPO-BRD-CRI-142,7,3 year warranty,Ships in 3-5 business days,In Stock,7 days return policy,11,Bella,Grant,28,female,bella.grant@x.dummyjson.com,+92 896-206-1901,bellag,192.65,96.46,Vanderbilt University,user
59,74029.97,61859.29,59,2,3,170,2,73999.98,16.44,61834.38,https://cdn.dummyjson.com/product-images/vehicle/durango-sxt-rwd/thumbnail.webp,Durango SXT RWD,"The Durango SXT RWD is a spacious and versatile SUV, known for its strong performance and family-friendly features.",vehicle,36999.99,16.44,4.07,95,Dodge,VEH-DOD-DUR-170,1,2 year warranty,Ships in 1 month,In Stock,30 days return policy,1,Ethan,Fletcher,34,male,ethan.fletcher@x.dummyjson.com,+1 251-564-2643,ethanf,183.99,83.98,Cornell University,user
59,74029.97,61859.29,59,2,3,145,1,29.99,16.93,24.91,https://cdn.dummyjson.com/product-images/sports-accessories/cricket-wicket/thumbnail.webp,Cricket Wicket,"The Cricket Wicket is a set of three stumps and two bails, forming a wicket used in the sport of cricket. Batsmen aim to protect the wicket while scoring runs.",sports-accessories,29.99,16.93,4.73,25,,SPO-BRD-CRI-145,5,3 months warranty,Ships overnight,In Stock,No return policy,20,Ethan,Fletcher,34,male,ethan.fletcher@x.dummyjson.com,+1 251-564-2643,ethanf,183.99,83.98,Cornell University,user
60,7649.92,6748.39,60,2,8,82,5,7499.95,11.89,6608.21,https://cdn.dummyjson.com/product-images/laptops/new-dell-xps-13-9300-laptop/thumbnail.webp,New DELL XPS 13 9300 Laptop,"The New DELL XPS 13 9300 Laptop is a compact and powerful device, featuring a virtually borderless InfinityEdge display and high-end performance for various tasks.",laptops,1499.99,11.89,2.67,74,Dell,LAP-DEL-DEL-082,2,2 year warranty,Ships in 2 weeks,In Stock,60 days return policy,1,Lillian,Simmons,33,female,lillian.simmons@x.dummyjson.com,+61 857-625-2029,lillians,173.72,87.33,Boston University,user
60,7649.92,6748.39,60,2,8,149,3,149.97,6.53,140.18,https://cdn.dummyjson.com/product-images/sports-accessories/iron-golf/thumbnail.webp,Iron Golf,"The Iron Golf is a type of golf club designed for various golf shots. It features a solid metal head and is used for approach shots, chipping, and other golfing techniques.",sports-accessories,49.99,6.53,4.41,90,,SPO-BRD-IRO-149,2,3 months warranty,Ships in 2 weeks,In Stock,7 days return policy,8,Lillian,Simmons,33,female,lillian.simmons@x.dummyjson.com,+61 857-625-2029,lillians,173.72,87.33,Boston University,user
61,642.86,571.58,61,5,14,66,4,359.96,12.13,316.3,https://cdn.dummyjson.com/product-images/kitchen-accessories/microwave-oven/thumbnail.webp,Microwave Oven,"The Microwave Oven is a versatile kitchen appliance for quick and efficient cooking, reheating, and defrosting. Its compact size makes it suitable for various kitchen setups.",kitchen-accessories,89.99,12.13,4.82,59,,KIT-BRD-MIC-066,9,1 year warranty,Ships in 1 week,In Stock,7 days return policy,4,Mason,Pearson,29,male,mason.pearson@x.dummyjson.com,+1 394-401-1757,masonpx,198.74,60.14,University of Chicago,user
61,642.86,571.58,61,5,14,119,4,51.96,16.39,43.44,https://cdn.dummyjson.com/product-images/skin-care/olay-ultra-moisture-shea-butter-body-wash/thumbnail.webp,Olay Ultra Moisture Shea Butter Body Wash,Olay Ultra Moisture Shea Butter Body Wash is a luxurious body wash that hydrates and nourishes your skin with the moisturizing power of shea butter. Enjoy a rich lather and silky-smooth skin.,skin-care,12.99,16.39,4.51,34,Olay,SKI-OLA-OLA-119,4,1 year warranty,Ships in 1-2 business days,In Stock,30 days return policy,33,Mason,Pearson,29,male,mason.pearson@x.dummyjson.com,+1 394-401-1757,masonpx,198.74,60.14,University of Chicago,user
61,642.86,571.58,61,5,14,107,3,149.97,5.73,141.38,https://cdn.dummyjson.com/product-images/mobile-accessories/beats-flex-wireless-earphones/thumbnail.webp,Beats Flex Wireless Earphones,"The Beats Flex Wireless Earphones offer a comfortable and versatile audio experience. With magnetic earbuds and up to 12 hours of battery life, they are ideal for everyday use.",mobile-accessories,49.99,5.73,4.24,50,Beats,MOB-BEA-BEA-107,8,1 year warranty,Ships in 1-2 business days,In Stock,7 days return policy,17,Mason,Pearson,29,male,mason.pearson@x.dummyjson.com,+1 394-401-1757,masonpx,198.74,60.14,University of Chicago,user
