cart_id,cart_total,cart_discounted_total,user_id,cart_total_products,cart_total_quantity,product_id,product_quantity,product_total,discount_percentage,product_discounted_total,thumbnail,product_name,description,category,product_price,discountPercentage,rating,stock,brand,sku,weight_product,warrantyInformation,shippingInformation,availabilityStatus,returnPolicy,minimumOrderQuantity,firstName,lastName,age,gender,email,phone,username,height,weight_user,university,role
95,154490.76,129783.31,95,6,24,183,5,124.94999999999999,15.18,105.98,https://cdn.dummyjson.com/product-images/womens-jewellery/green-oval-earring/thumbnail.webp,Green Oval Earring,"The Green Oval Earring is a stylish and versatile accessory with a unique oval shape. Whether for casual or dressy occasions, its green hue and contemporary design make it a standout piece.",womens-jewellery,24.99,15.18,3.57,73,,WOM-BRD-GRE-183,10,3 months warranty,Ships in 3-5 business days,In Stock,60 days return policy,19,Miles,Stevenson,32,male,miles.stevenson@x.dummyjson.com,+49 708-659-4394,miless,151.88,97.67,Wake Forest University,user
95,154490.76,129783.31,95,6,24,133,4,2799.96,5.59,2643.44,https://cdn.dummyjson.com/product-images/smartphones/samsung-galaxy-s10/thumbnail.webp,Samsung Galaxy S10,"The Samsung Galaxy S10 is a flagship device featuring a dynamic AMOLED display, versatile camera system, and powerful performance. It represents innovation and excellence in smartphone technology.",smartphones,699.99,5.59,3.06,19,Samsung,SMA-SAM-SAM-133,9,No warranty,Ships in 2 weeks,In Stock,30 days return policy,2,Miles,Stevenson,32,male,miles.stevenson@x.dummyjson.com,+49 708-659-4394,miless,151.88,97.67,Wake Forest University,user
95,154490.76,129783.31,95,6,24,140,4,59.96,7.44,55.5,https://cdn.dummyjson.com/product-images/sports-accessories/basketball/thumbnail.webp,Basketball,"The Basketball is a standard ball used in basketball games. It is designed for dribbling, shooting, and passing in the game of basketball, suitable for both indoor and outdoor play.",sports-accessories,14.99,7.44,4.66,75,,SPO-BRD-BAS-140,7,1 year warranty,Ships in 1 week,In Stock,90 days return policy,11,Miles,Stevenson,32,male,miles.stevenson@x.dummyjson.com,+49 708-659-4394,miless,151.88,97.67,Wake Forest University,user
96,104.93,92.51,96,2,7,5,5,44.95,11.44,39.81,https://cdn.dummyjson.com/product-images/beauty/red-nail-polish/thumbnail.webp,Red Nail Polish,"The Red Nail Polish offers a rich and glossy red hue for vibrant and polished nails. With a quick-drying formula, it provides a salon-quality finish at home.",beauty,8.99,11.44,4.32,79,Nail Couture,BEA-NAI-NAI-005,8,1 month warranty,Ships overnight,In Stock,No return policy,22,Aurora,Lawson,27,female,aurora.lawson@x.dummyjson.com,+92 802-452-4192,auroral,174.28,88.18,Boston University,user
96,104.93,92.51,96,2,7,162,2,59.98,12.13,52.7,https://cdn.dummyjson.com/product-images/tops/blue-frock/thumbnail.webp,Blue Frock,"The Blue Frock is a charming and stylish dress for various occasions. With a vibrant blue color and a comfortable design, it adds a touch of elegance to your wardrobe.",tops,29.99,12.13,4.17,52,,TOP-BRD-BLU-162,5,Lifetime warranty,Ships in 2 weeks,In Stock,60 days return policy,4,Aurora,Lawson,27,female,aurora.lawson@x.dummyjson.com,+92 802-452-4192,auroral,174.28,88.18,Boston University,user
97,2013.93,1623.42,97,3,7,18,1,8.99,9.58,8.13,https://cdn.dummyjson.com/product-images/groceries/cat-food/thumbnail.webp,Cat Food,Nutritious cat food formulated to meet the dietary needs of your feline friend.,groceries,8.99,9.58,3.13,46,,GRO-BRD-FOO-018,10,1 year warranty,Ships overnight,In Stock,No return policy,18,Oscar,Powers,34,male,oscar.powers@x.dummyjson.com,+61 929-572-1408,oscarp,169.03,62.55,University of Virginia,user
97,2013.93,1623.42,97,3,7,41,2,4.98,13.28,4.32,https://cdn.dummyjson.com/product-images/groceries/tissue-paper-box/thumbnail.webp,Tissue Paper Box,"Convenient tissue paper box for everyday use, providing soft and absorbent tissues.",groceries,2.49,13.28,2.69,86,,GRO-BRD-TIS-041,1,No warranty,Ships in 1-2 business days,In Stock,90 days return policy,44,Oscar,Powers,34,male,oscar.powers@x.dummyjson.com,+61 929-572-1408,oscarp,169.03,62.55,University of Virginia,user
97,2013.93,1623.42,97,3,7,132,4,1999.96,19.45,1610.97,https://cdn.dummyjson.com/product-images/smartphones/samsung-galaxy-s8/thumbnail.webp,Samsung Galaxy S8,"The Samsung Galaxy S8 is a premium smartphone with an Infinity Display, offering a stunning visual experience. It boasts advanced camera capabilities and cutting-edge technology.",smartphones,499.99,19.45,4.4,0,Samsung,SMA-SAM-SAM-132,6,2 year warranty,Ships in 1 week,Out of Stock,No return policy,4,Oscar,Powers,34,male,oscar.powers@x.dummyjson.com,+61 929-572-1408,oscarp,169.03,62.55,University of Virginia,user
98,1010.78,896.98,98,6,22,180,5,249.95000000000002,17.68,205.76,https://cdn.dummyjson.com/product-images/womens-dresses/dress-pea/thumbnail.webp,Dress Pea,"The Dress Pea is a stylish and comfortable dress with a pea pattern. Perfect for casual outings, it adds a playful and fun element to your wardrobe, making it a great choice for day-to-day wear.",womens-dresses,49.99,17.68,4.88,6,,WOM-BRD-DRE-180,1,2 year warranty,Ships overnight,Low Stock,90 days return policy,6,Clara,Berry,31,female,clara.berry@x.dummyjson.com,+1 390-831-5172,clarab,151.55,90.27,Boston College,user
98,1010.78,896.98,98,6,22,48,2,15.98,2.84,15.53,https://cdn.dummyjson.com/product-images/kitchen-accessories/bamboo-spatula/thumbnail.webp,Bamboo Spatula,"The Bamboo Spatula is a versatile kitchen tool made from eco-friendly bamboo. Ideal for flipping, stirring, and serving various dishes.",kitchen-accessories,7.99,2.84,3.27,37,,KIT-BRD-BAM-048,3,1 month warranty,Ships overnight,In Stock,60 days return policy,29,Clara,Berry,31,female,clara.berry@x.dummyjson.com,+1 390-831-5172,clarab,151.55,90.27,Boston College,user
98,1010.78,896.98,98,6,22,99,5,499.95,12.07,439.61,https://cdn.dummyjson.com/product-images/mobile-accessories/amazon-echo-plus/thumbnail.webp,Amazon Echo Plus,The Amazon Echo Plus is a smart speaker with built-in Alexa voice control. It features premium sound quality and serves as a hub for controlling smart home devices.,mobile-accessories,99.99,12.07,4.99,61,Amazon,MOB-AMA-AMA-099,5,6 months warranty,Ships in 1 week,In Stock,7 days return policy,9,Clara,Berry,31,female,clara.berry@x.dummyjson.com,+1 390-831-5172,clarab,151.55,90.27,Boston College,user
98,1010.78,896.98,98,6,22,188,1,29.99,14.14,25.75,https://cdn.dummyjson.com/product-images/womens-shoes/pampi-shoes/thumbnail.webp,Pampi Shoes,"Pampi Shoes offer a blend of comfort and style for everyday use. With a versatile design, they are suitable for various casual occasions, providing a trendy and relaxed look.",womens-shoes,29.99,14.14,3.05,49,Pampi,WOM-PAM-PAM-188,7,No warranty,Ships in 1 week,In Stock,60 days return policy,12,Clara,Berry,31,female,clara.berry@x.dummyjson.com,+1 390-831-5172,clarab,151.55,90.27,Boston College,user
98,1010.78,896.98,98,6,22,156,4,139.96,1.01,138.55,https://cdn.dummyjson.com/product-images/sunglasses/green-and-black-glasses/thumbnail.webp,Green and Black Glasses,"The Green and Black Glasses feature a bold combination of green and black colors, adding a touch of vibrancy to your eyewear collection. They are both stylish and eye-catching.",sunglasses,34.99,1.01,4.55,24,Fashion Shades,SUN-FAS-GRE-156,7,1 year warranty,Ships overnight,In Stock,30 days return policy,15,Clara,Berry,31,female,clara.berry@x.dummyjson.com,+1 390-831-5172,clarab,151.55,90.27,Boston College,user
98,1010.78,896.98,98,6,22,24,5,74.95,4.23,71.78,https://cdn.dummyjson.com/product-images/groceries/fish-steak/thumbnail.webp,Fish Steak,"Quality fish steak, suitable for grilling, baking, or pan-searing.",groceries,14.99,4.23,3.78,74,,GRO-BRD-FIS-024,6,1 month warranty,Ships in 3-5 business days,In Stock,60 days return policy,50,Clara,Berry,31,female,clara.berry@x.dummyjson.com,+1 390-831-5172,clarab,151.55,90.27,Boston College,user
99,124.4,117.96,99,4,10,18,3,26.97,9.58,24.39,https://cdn.dummyjson.com/product-images/groceries/cat-food/thumbnail.webp,Cat Food,Nutritious cat food formulated to meet the dietary needs of your feline friend.,groceries,8.99,9.58,3.13,46,,GRO-BRD-FOO-018,10,1 year warranty,Ships overnight,In Stock,No return policy,18,Gavin,Stanley,33,male,gavin.stanley@x.dummyjson.com,+44 466-358-6026,gavins,173.37,92.17,University of California--Irvine,user
99,124.4,117.96,99,4,10,68,3,74.97,3.0,72.72,https://cdn.dummyjson.com/product-images/kitchen-accessories/pan/thumbnail.webp,Pan,"The Pan is a versatile and essential cookware item for frying, sautéing, and cooking various dishes. Its non-stick coating ensures easy food release and cleanup.",kitchen-accessories,24.99,3.0,2.79,90,,KIT-BRD-PRD-068,8,1 year warranty,Ships in 3-5 business days,In Stock,30 days return policy,17,Gavin,Stanley,33,male,gavin.stanley@x.dummyjson.com,+44 466-358-6026,gavins,173.37,92.17,University of California--Irvine,user
99,124.4,117.96,99,4,10,146,1,5.99,2.95,5.81,https://cdn.dummyjson.com/product-images/sports-accessories/feather-shuttlecock/thumbnail.webp,Feather Shuttlecock,"The Feather Shuttlecock is used in the sport of badminton. It features natural feathers and is designed for high-speed play, providing stability and accuracy during matches.",sports-accessories,5.99,2.95,2.85,95,,SPO-BRD-FEA-146,4,3 year warranty,Ships in 1-2 business days,In Stock,60 days return policy,30,Gavin,Stanley,33,male,gavin.stanley@x.dummyjson.com,+44 466-358-6026,gavins,173.37,92.17,University of California--Irvine,user
99,124.4,117.96,99,4,10,28,3,16.47,8.69,15.04,https://cdn.dummyjson.com/product-images/groceries/ice-cream/thumbnail.webp,Ice Cream,"Creamy and delicious ice cream, available in various flavors for a delightful treat.",groceries,5.49,8.69,3.39,27,,GRO-BRD-CRE-028,1,1 month warranty,Ships in 2 weeks,In Stock,No return policy,42,Gavin,Stanley,33,male,gavin.stanley@x.dummyjson.com,+44 466-358-6026,gavins,173.37,92.17,University of California--Irvine,user
100,33003.13,31771.92,100,2,7,31,4,3.16,9.7,2.85,https://cdn.dummyjson.com/product-images/groceries/lemon/thumbnail.webp,Lemon,"Zesty and tangy lemons, versatile for cooking, baking, or making refreshing beverages.",groceries,0.79,9.7,3.53,31,,GRO-BRD-LEM-031,3,No warranty,Ships in 1 month,In Stock,7 days return policy,29,Lila,Hudson,28,female,lila.hudson@x.dummyjson.com,+91 697-236-1544,lilah,190.1,70.03,University of Notre Dame,user
100,33003.13,31771.92,100,2,7,97,3,32999.97,3.73,31769.07,https://cdn.dummyjson.com/product-images/mens-watches/rolex-datejust/thumbnail.webp,Rolex Datejust,"The Rolex Datejust is an iconic and versatile timepiece with a date window. Known for its timeless design and reliability, it's a symbol of Rolex's watchmaking excellence.",mens-watches,10999.99,3.73,3.66,86,Rolex,MEN-ROL-ROL-097,4,2 year warranty,Ships in 1 month,In Stock,7 days return policy,1,Lila,Hudson,28,female,lila.hudson@x.dummyjson.com,+91 697-236-1544,lilah,190.1,70.03,University of Notre Dame,user
101,1551.88,1464.78,101,5,12,57,3,29.97,3.5,28.92,https://cdn.dummyjson.com/product-images/kitchen-accessories/fine-mesh-strainer/thumbnail.webp,Fine Mesh Strainer,The Fine Mesh Strainer is a versatile tool for straining liquids and sifting dry ingredients. Its fine mesh ensures efficient filtering for smooth cooking and baking.,kitchen-accessories,9.99,3.5,3.04,85,,KIT-BRD-FIN-057,9,1 month warranty,Ships overnight,In Stock,7 days return policy,43,Alice,Smith,29,female,alice.smith@x.dummyjson.com,+61 611-556-8989,alicej,171.67,56.25,Wake Forest University,user
101,1551.88,1464.78,101,5,12,153,3,35.97,12.25,31.56,https://cdn.dummyjson.com/product-images/sports-accessories/volleyball/thumbnail.webp,Volleyball,"The Volleyball is a standard ball used in the sport of volleyball. It is designed for passing, setting, and spiking over the net during volleyball matches.",sports-accessories,11.99,12.25,3.84,0,,SPO-BRD-VOL-153,3,1 week warranty,Ships in 1 week,Out of Stock,90 days return policy,44,Alice,Smith,29,female,alice.smith@x.dummyjson.com,+61 611-556-8989,alicej,171.67,56.25,Wake Forest University,user
101,1551.88,1464.78,101,5,12,133,2,1399.98,5.59,1321.72,https://cdn.dummyjson.com/product-images/smartphones/samsung-galaxy-s10/thumbnail.webp,Samsung Galaxy S10,"The Samsung Galaxy S10 is a flagship device featuring a dynamic AMOLED display, versatile camera system, and powerful performance. It represents innovation and excellence in smartphone technology.",smartphones,699.99,5.59,3.06,19,Samsung,SMA-SAM-SAM-133,9,No warranty,Ships in 2 weeks,In Stock,30 days return policy,2,Alice,Smith,29,female,alice.smith@x.dummyjson.com,+61 611-556-8989,alicej,171.67,56.25,Wake Forest University,user
101,1551.88,1464.78,101,5,12,22,1,10.99,10.27,9.86,https://cdn.dummyjson.com/product-images/groceries/dog-food/thumbnail.webp,Dog Food,Specially formulated dog food designed to provide essential nutrients for your canine companion.,groceries,10.99,10.27,4.55,71,,GRO-BRD-FOO-022,10,No warranty,Ships in 1-2 business days,In Stock,60 days return policy,43,Alice,Smith,29,female,alice.smith@x.dummyjson.com,+61 611-556-8989,alicej,171.67,56.25,Wake Forest University,user
101,1551.88,1464.78,101,5,12,68,3,74.97,3.0,72.72,https://cdn.dummyjson.com/product-images/kitchen-accessories/pan/thumbnail.webp,Pan,"The Pan is a versatile and essential cookware item for frying, sautéing, and cooking various dishes. Its non-stick coating ensures easy food release and cleanup.",kitchen-accessories,24.99,3.0,2.79,90,,KIT-BRD-PRD-068,8,1 year warranty,Ships in 3-5 business days,In Stock,30 days return policy,17,Alice,Smith,29,female,alice.smith@x.dummyjson.com,+61 611-556-8989,alicej,171.67,56.25,Wake Forest University,user
102,171.9,155.13,102,5,10,22,1,10.99,10.27,9.86,https://cdn.dummyjson.com/product-images/groceries/dog-food/thumbnail.webp,Dog Food,Specially formulated dog food designed to provide essential nutrients for your canine companion.,groceries,10.99,10.27,4.55,71,,GRO-BRD-FOO-022,10,No warranty,Ships in 1-2 business days,In Stock,60 days return policy,43,John,Doe,36,male,john.doe@x.dummyjson.com,+44 242-757-6754,johnd,179.44,93.42,Brown University,user
102,171.9,155.13,102,5,10,111,1,12.99,19.12,10.51,https://cdn.dummyjson.com/product-images/mobile-accessories/selfie-stick-monopod/thumbnail.webp,Selfie Stick Monopod,The Selfie Stick Monopod is a extendable and foldable device for capturing the perfect selfie or group photo. Compatible with smartphones and cameras.,mobile-accessories,12.99,19.12,3.88,11,SnapTech,MOB-SNA-SEL-111,2,3 year warranty,Ships in 1-2 business days,In Stock,30 days return policy,8,John,Doe,36,male,john.doe@x.dummyjson.com,+44 242-757-6754,johnd,179.44,93.42,Brown University,user
102,171.9,155.13,102,5,10,53,4,51.96,8.03,47.79,https://cdn.dummyjson.com/product-images/kitchen-accessories/chopping-board/thumbnail.webp,Chopping Board,"The Chopping Board is an essential kitchen accessory for food preparation. Made from durable material, it provides a safe and hygienic surface for cutting and chopping.",kitchen-accessories,12.99,8.03,3.7,14,,KIT-BRD-CHO-053,2,3 months warranty,Ships in 2 weeks,In Stock,No return policy,5,John,Doe,36,male,john.doe@x.dummyjson.com,+44 242-757-6754,johnd,179.44,93.42,Brown University,user
102,171.9,155.13,102,5,10,45,2,79.98,7.46,74.01,https://cdn.dummyjson.com/product-images/home-decoration/house-showpiece-plant/thumbnail.webp,House Showpiece Plant,The House Showpiece Plant is an artificial plant that brings a touch of nature to your home without the need for maintenance. It adds greenery and style to any space.,home-decoration,39.99,7.46,4.67,28,,HOM-BRD-HOU-045,8,1 year warranty,Ships in 1 week,In Stock,No return policy,3,John,Doe,36,male,john.doe@x.dummyjson.com,+44 242-757-6754,johnd,179.44,93.42,Brown University,user
102,171.9,155.13,102,5,10,63,2,15.98,18.91,12.96,https://cdn.dummyjson.com/product-images/kitchen-accessories/kitchen-sieve/thumbnail.webp,Kitchen Sieve,The Kitchen Sieve is a versatile tool for sifting and straining dry and wet ingredients. Its fine mesh design ensures smooth results in your cooking and baking.,kitchen-accessories,7.99,18.91,3.09,68,,KIT-BRD-KIT-063,5,1 month warranty,Ships overnight,In Stock,No return policy,5,John,Doe,36,male,john.doe@x.dummyjson.com,+44 242-757-6754,johnd,179.44,93.42,Brown University,user
103,35.89,31.79,103,3,11,37,5,9.95,9.9,8.96,https://cdn.dummyjson.com/product-images/groceries/red-onions/thumbnail.webp,Red Onions,"Flavorful and aromatic red onions, perfect for adding depth to your savory dishes.",groceries,1.99,9.9,4.2,82,,GRO-BRD-ONI-037,9,1 month warranty,Ships in 3-5 business days,In Stock,7 days return policy,8,Emily,Brown,43,female,emily.brown@x.dummyjson.com,+61 875-999-8871,emilyt,181.96,89.65,Georgetown University,user
103,35.89,31.79,103,3,11,39,4,7.96,17.48,6.57,https://cdn.dummyjson.com/product-images/groceries/soft-drinks/thumbnail.webp,Soft Drinks,"Assorted soft drinks in various flavors, perfect for refreshing beverages.",groceries,1.99,17.48,4.75,53,,GRO-BRD-SOF-039,9,6 months warranty,Ships in 2 weeks,In Stock,7 days return policy,10,Emily,Brown,43,female,emily.brown@x.dummyjson.com,+61 875-999-8871,emilyt,181.96,89.65,Georgetown University,user
103,35.89,31.79,103,3,11,18,2,17.98,9.58,16.26,https://cdn.dummyjson.com/product-images/groceries/cat-food/thumbnail.webp,Cat Food,Nutritious cat food formulated to meet the dietary needs of your feline friend.,groceries,8.99,9.58,3.13,46,,GRO-BRD-FOO-018,10,1 year warranty,Ships overnight,In Stock,No return policy,18,Emily,Brown,43,female,emily.brown@x.dummyjson.com,+61 875-999-8871,emilyt,181.96,89.65,Georgetown University,user
104,1120.23,990.53,104,6,27,87,5,139.95,11.38,124.02,https://cdn.dummyjson.com/product-images/mens-shirts/men-check-shirt/thumbnail.webp,Men Check Shirt,"The Men Check Shirt is a classic and versatile shirt featuring a stylish check pattern. Suitable for various occasions, it adds a smart and polished touch to your wardrobe.",mens-shirts,27.99,11.38,2.72,95,Urban Chic,MEN-URB-CHE-087,10,No warranty,Ships in 1-2 business days,In Stock,30 days return policy,12,Michael,Johnson,25,male,michael.johnson@x.dummyjson.com,+92 290-825-4767,michaelj,164.38,97.18,University of Miami,user
104,1120.23,990.53,104,6,27,24,5,74.95,4.23,71.78,https://cdn.dummyjson.com/product-images/groceries/fish-steak/thumbnail.webp,Fish Steak,"Quality fish steak, suitable for grilling, baking, or pan-searing.",groceries,14.99,4.23,3.78,74,,GRO-BRD-FIS-024,6,1 month warranty,Ships in 3-5 business days,In Stock,60 days return policy,50,Michael,Johnson,25,male,michael.johnson@x.dummyjson.com,+92 290-825-4767,michaelj,164.38,97.18,University of Miami,user
104,1120.23,990.53,104,6,27,32,3,10.47,13.74,9.03,https://cdn.dummyjson.com/product-images/groceries/milk/thumbnail.webp,Milk,"Fresh and nutritious milk, a staple for various recipes and daily consumption.",groceries,3.49,13.74,2.61,27,,GRO-BRD-MIL-032,5,3 year warranty,Ships in 2 weeks,In Stock,7 days return policy,5,Michael,Johnson,25,male,michael.johnson@x.dummyjson.com,+92 290-825-4767,michaelj,164.38,97.18,University of Miami,user
104,1120.23,990.53,104,6,27,66,4,359.96,12.13,316.3,https://cdn.dummyjson.com/product-images/kitchen-accessories/microwave-oven/thumbnail.webp,Microwave Oven,"The Microwave Oven is a versatile kitchen appliance for quick and efficient cooking, reheating, and defrosting. Its compact size makes it suitable for various kitchen setups.",kitchen-accessories,89.99,12.13,4.82,59,,KIT-BRD-MIC-066,9,1 year warranty,Ships in 1 week,In Stock,7 days return policy,4,Michael,Johnson,25,male,michael.johnson@x.dummyjson.com,+92 290-825-4767,michaelj,164.38,97.18,University of Miami,user
104,1120.23,990.53,104,6,27,55,5,34.95,14.76,29.79,https://cdn.dummyjson.com/product-images/kitchen-accessories/egg-slicer/thumbnail.webp,Egg Slicer,"The Egg Slicer is a convenient tool for slicing boiled eggs evenly. It's perfect for salads, sandwiches, and other dishes where sliced eggs are desired.",kitchen-accessories,6.99,14.76,3.09,40,,KIT-BRD-SLI-055,2,1 week warranty,Ships in 1 month,In Stock,No return policy,32,Michael,Johnson,25,male,michael.johnson@x.dummyjson.com,+92 290-825-4767,michaelj,164.38,97.18,University of Miami,user
104,1120.23,990.53,104,6,27,99,5,499.95,12.07,439.61,https://cdn.dummyjson.com/product-images/mobile-accessories/amazon-echo-plus/thumbnail.webp,Amazon Echo Plus,The Amazon Echo Plus is a smart speaker with built-in Alexa voice control. It features premium sound quality and serves as a hub for controlling smart home devices.,mobile-accessories,99.99,12.07,4.99,61,Amazon,MOB-AMA-AMA-099,5,6 months warranty,Ships in 1 week,In Stock,7 days return policy,9,Michael,Johnson,25,male,michael.johnson@x.dummyjson.com,+92 290-825-4767,michaelj,164.38,97.18,University of Miami,user
105,147.91,134.21,105,3,9,148,2,19.98,17.37,16.51,https://cdn.dummyjson.com/product-images/sports-accessories/golf-ball/thumbnail.webp,Golf Ball,"The Golf Ball is a small ball used in the sport of golf. It features dimples on its surface, providing aerodynamic lift and distance when struck by a golf club.",sports-accessories,9.99,17.37,4.3,84,,SPO-BRD-GOL-148,3,1 year warranty,Ships in 3-5 business days,In Stock,No return policy,40,Emma,Wilson,32,female,emma.wilson@x.dummyjson.com,+49 933-975-3236,emmac,164.59,97.44,Tufts University,user
105,147.91,134.21,105,3,9,109,3,59.97,8.58,54.82,https://cdn.dummyjson.com/product-images/mobile-accessories/monopod/thumbnail.webp,Monopod,"The Monopod is a versatile camera accessory for stable and adjustable shooting. Perfect for capturing selfies, group photos, and videos with ease.",mobile-accessories,19.99,8.58,4.43,48,TechGear,MOB-TEC-MON-109,10,1 year warranty,Ships in 1-2 business days,In Stock,60 days return policy,30,Emma,Wilson,32,female,emma.wilson@x.dummyjson.com,+49 933-975-3236,emmac,164.59,97.44,Tufts University,user
105,147.91,134.21,105,3,9,75,4,67.96,7.48,62.88,https://cdn.dummyjson.com/product-images/kitchen-accessories/tray/thumbnail.webp,Tray,"The Tray is a functional and decorative item for serving snacks, appetizers, or drinks. Its stylish design makes it a versatile accessory for entertaining guests.",kitchen-accessories,16.99,7.48,4.62,71,,KIT-BRD-TRA-075,10,5 year warranty,Ships in 2 weeks,In Stock,7 days return policy,23,Emma,Wilson,32,female,emma.wilson@x.dummyjson.com,+49 933-975-3236,emmac,164.59,97.44,Tufts University,user
106,104.97,94.38,106,2,3,84,1,24.99,0.94,24.76,https://cdn.dummyjson.com/product-images/mens-shirts/gigabyte-aorus-men-tshirt/thumbnail.webp,Gigabyte Aorus Men Tshirt,"The Gigabyte Aorus Men Tshirt is a cool and casual shirt for gaming enthusiasts. With the Aorus logo and sleek design, it's perfect for expressing your gaming style.",mens-shirts,24.99,0.94,3.18,90,Gigabyte,MEN-GIG-GIG-084,4,3 year warranty,Ships overnight,In Stock,30 days return policy,16,David,Martinez,40,male,david.martinez@x.dummyjson.com,+1 846-350-3024,davidm,159.35,88.58,University of Texas--Austin,user
106,104.97,94.38,106,2,3,166,2,79.98,12.95,69.62,https://cdn.dummyjson.com/product-images/tops/tartan-dress/thumbnail.webp,Tartan Dress,"The Tartan Dress features a classic tartan pattern, bringing a timeless and sophisticated touch to your wardrobe. Perfect for fall and winter, it adds a hint of traditional charm.",tops,39.99,12.95,4.05,73,,TOP-BRD-TAR-166,8,1 month warranty,Ships overnight,In Stock,No return policy,1,David,Martinez,40,male,david.martinez@x.dummyjson.com,+1 846-350-3024,davidm,159.35,88.58,University of Texas--Austin,user
107,129.97,120.92,107,2,3,52,1,29.99,6.53,28.03,https://cdn.dummyjson.com/product-images/kitchen-accessories/carbon-steel-wok/thumbnail.webp,Carbon Steel Wok,"The Carbon Steel Wok is a versatile cooking pan suitable for stir-frying, sautéing, and deep frying. Its sturdy construction ensures even heat distribution for delicious meals.",kitchen-accessories,29.99,6.53,4.05,40,,KIT-BRD-CAR-052,2,2 year warranty,Ships in 1-2 business days,In Stock,7 days return policy,9,Olivia,Anderson,30,female,olivia.anderson@x.dummyjson.com,+44 952-688-2836,oliviah,155.22,99.18,Boston University,user
107,129.97,120.92,107,2,3,47,2,99.98,7.09,92.89,https://cdn.dummyjson.com/product-images/home-decoration/table-lamp/thumbnail.webp,Table Lamp,"The Table Lamp is a functional and decorative lighting solution for your living space. With a modern design, it provides both ambient and task lighting, enhancing the atmosphere.",home-decoration,49.99,7.09,3.55,9,,HOM-BRD-TAB-047,4,3 months warranty,Ships in 1-2 business days,In Stock,90 days return policy,2,Olivia,Anderson,30,female,olivia.anderson@x.dummyjson.com,+44 952-688-2836,oliviah,155.22,99.18,Boston University,user
108,1062.96,935.63,108,2,4,142,1,12.99,8.63,11.87,https://cdn.dummyjson.com/product-images/sports-accessories/cricket-ball/thumbnail.webp,Cricket Ball,"The Cricket Ball is a hard leather ball used in the sport of cricket. It is bowled and batted in the game, and its hardness and seam contribute to the dynamics of cricket play.",sports-accessories,12.99,8.63,3.53,30,,SPO-BRD-CRI-142,7,3 year warranty,Ships in 3-5 business days,In Stock,7 days return policy,11,James,Garcia,46,male,james.garcia@x.dummyjson.com,+1 958-844-1106,jamesg,175.44,67.27,University of Notre Dame,user
