id,title,description,category,price,discountPercentage,rating,stock,brand,sku,weight,warrantyInformation,shippingInformation,availabilityStatus,returnPolicy,minimumOrderQuantity
1,Essence Mascara Lash Princess,The Essence Mascara Lash Princess is a popular mascara known for its volumizing and lengthening effects. Achieve dramatic lashes with this long-lasting and cruelty-free formula.,beauty,9.99,10.48,2.56,99,Essence,BEA-ESS-ESS-001,4,1 week warranty,Ships in 3-5 business days,In Stock,No return policy,48
2,Eyeshadow Palette with Mirror,"The Eyeshadow Palette with Mirror offers a versatile range of eyeshadow shades for creating stunning eye looks. With a built-in mirror, it's convenient for on-the-go makeup application.",beauty,19.99,18.19,2.86,34,Glamour Beauty,BEA-GLA-EYE-002,9,1 year warranty,Ships in 2 weeks,In Stock,7 days return policy,20
3,Powder Canister,"The Powder Canister is a finely milled setting powder designed to set makeup and control shine. With a lightweight and translucent formula, it provides a smooth and matte finish.",beauty,14.99,9.84,4.64,89,Velvet Touch,BEA-VEL-POW-003,8,3 months warranty,Ships in 1-2 business days,In Stock,No return policy,22
4,Red Lipstick,"The Red Lipstick is a classic and bold choice for adding a pop of color to your lips. With a creamy and pigmented formula, it provides a vibrant and long-lasting finish.",beauty,12.99,12.16,4.36,91,Chic Cosmetics,BEA-CHI-LIP-004,1,3 year warranty,Ships in 1 week,In Stock,7 days return policy,40
5,Red Nail Polish,"The Red Nail Polish offers a rich and glossy red hue for vibrant and polished nails. With a quick-drying formula, it provides a salon-quality finish at home.",beauty,8.99,11.44,4.32,79,Nail Couture,BEA-NAI-NAI-005,8,1 month warranty,Ships overnight,In Stock,No return policy,22
6,Calvin Klein CK One,"CK One by Calvin Klein is a classic unisex fragrance, known for its fresh and clean scent. It's a versatile fragrance suitable for everyday wear.",fragrances,49.99,1.89,4.37,29,Calvin Klein,FRA-CAL-CAL-006,7,1 week warranty,Ships overnight,In Stock,90 days return policy,9
7,Chanel Coco Noir Eau De,"Coco Noir by Chanel is an elegant and mysterious fragrance, featuring notes of grapefruit, rose, and sandalwood. Perfect for evening occasions.",fragrances,129.99,16.51,4.26,58,Chanel,FRA-CHA-CHA-007,7,3 year warranty,Ships overnight,In Stock,No return policy,1
8,Dior J'adore,"J'adore by Dior is a luxurious and floral fragrance, known for its blend of ylang-ylang, rose, and jasmine. It embodies femininity and sophistication.",fragrances,89.99,14.72,3.8,98,Dior,FRA-DIO-DIO-008,4,1 week warranty,Ships in 2 weeks,In Stock,7 days return policy,10
9,Dolce Shine Eau de,"Dolce Shine by Dolce & Gabbana is a vibrant and fruity fragrance, featuring notes of mango, jasmine, and blonde woods. It's a joyful and youthful scent.",fragrances,69.99,0.62,3.96,4,Dolce & Gabbana,FRA-DOL-DOL-009,6,3 year warranty,Ships in 1 month,Low Stock,7 days return policy,2
10,Gucci Bloom Eau de,"Gucci Bloom by Gucci is a floral and captivating fragrance, with notes of tuberose, jasmine, and Rangoon creeper. It's a modern and romantic scent.",fragrances,79.99,14.39,2.74,91,Gucci,FRA-GUC-GUC-010,7,6 months warranty,Ships overnight,In Stock,No return policy,2
11,Annibale Colombo Bed,"The Annibale Colombo Bed is a luxurious and elegant bed frame, crafted with high-quality materials for a comfortable and stylish bedroom.",furniture,1899.99,8.57,4.77,88,Annibale Colombo,FUR-ANN-ANN-011,10,1 year warranty,Ships in 1 month,In Stock,No return policy,1
12,Annibale Colombo Sofa,"The Annibale Colombo Sofa is a sophisticated and comfortable seating option, featuring exquisite design and premium upholstery for your living room.",furniture,2499.99,14.4,3.92,60,Annibale Colombo,FUR-ANN-ANN-012,6,Lifetime warranty,Ships in 1 week,In Stock,7 days return policy,1
13,Bedside Table African Cherry,"The Bedside Table in African Cherry is a stylish and functional addition to your bedroom, providing convenient storage space and a touch of elegance.",furniture,299.99,19.09,2.87,64,Furniture Co.,FUR-FUR-BED-013,2,5 year warranty,Ships overnight,In Stock,7 days return policy,3
14,Knoll Saarinen Executive Conference Chair,"The Knoll Saarinen Executive Conference Chair is a modern and ergonomic chair, perfect for your office or conference room with its timeless design.",furniture,499.99,2.01,4.88,26,Knoll,FUR-KNO-KNO-014,10,2 year warranty,Ships overnight,In Stock,60 days return policy,5
15,Wooden Bathroom Sink With Mirror,"The Wooden Bathroom Sink with Mirror is a unique and stylish addition to your bathroom, featuring a wooden sink countertop and a matching mirror.",furniture,799.99,8.8,3.59,7,Bath Trends,FUR-BAT-WOO-015,10,3 year warranty,Ships in 3-5 business days,Low Stock,60 days return policy,2
16,Apple,"Fresh and crisp apples, perfect for snacking or incorporating into various recipes.",groceries,1.99,12.62,4.19,8,,GRO-BRD-APP-016,9,3 year warranty,Ships in 2 weeks,In Stock,90 days return policy,7
17,Beef Steak,"High-quality beef steak, great for grilling or cooking to your preferred level of doneness.",groceries,12.99,9.61,4.47,86,,GRO-BRD-BEE-017,10,3 year warranty,Ships overnight,In Stock,60 days return policy,43
18,Cat Food,Nutritious cat food formulated to meet the dietary needs of your feline friend.,groceries,8.99,9.58,3.13,46,,GRO-BRD-FOO-018,10,1 year warranty,Ships overnight,In Stock,No return policy,18
19,Chicken Meat,"Fresh and tender chicken meat, suitable for various culinary preparations.",groceries,9.99,13.7,3.19,97,,GRO-BRD-CHI-019,1,1 year warranty,Ships in 1 month,In Stock,7 days return policy,22
20,Cooking Oil,"Versatile cooking oil suitable for frying, sautéing, and various culinary applications.",groceries,4.99,9.33,4.8,10,,GRO-BRD-COO-020,5,Lifetime warranty,Ships in 1-2 business days,In Stock,30 days return policy,46
21,Cucumber,"Crisp and hydrating cucumbers, ideal for salads, snacks, or as a refreshing side.",groceries,1.49,0.16,4.07,84,,GRO-BRD-CUC-021,4,2 year warranty,Ships in 1-2 business days,In Stock,7 days return policy,2
22,Dog Food,Specially formulated dog food designed to provide essential nutrients for your canine companion.,groceries,10.99,10.27,4.55,71,,GRO-BRD-FOO-022,10,No warranty,Ships in 1-2 business days,In Stock,60 days return policy,43
23,Eggs,"Fresh eggs, a versatile ingredient for baking, cooking, or breakfast.",groceries,2.99,11.05,2.53,9,,GRO-BRD-EGG-023,2,1 week warranty,Ships in 1 week,In Stock,No return policy,32
24,Fish Steak,"Quality fish steak, suitable for grilling, baking, or pan-searing.",groceries,14.99,4.23,3.78,74,,GRO-BRD-FIS-024,6,1 month warranty,Ships in 3-5 business days,In Stock,60 days return policy,50
25,Green Bell Pepper,"Fresh and vibrant green bell pepper, perfect for adding color and flavor to your dishes.",groceries,1.29,0.16,3.25,33,,GRO-BRD-GRE-025,2,1 month warranty,Ships in 1 week,In Stock,30 days return policy,12
26,Green Chili Pepper,"Spicy green chili pepper, ideal for adding heat to your favorite recipes.",groceries,0.99,1.0,3.66,3,,GRO-BRD-GRE-026,7,2 year warranty,Ships in 1 week,Low Stock,30 days return policy,39
27,Honey Jar,"Pure and natural honey in a convenient jar, perfect for sweetening beverages or drizzling over food.",groceries,6.99,14.4,3.97,34,,GRO-BRD-HON-027,2,1 month warranty,Ships in 1-2 business days,In Stock,90 days return policy,47
28,Ice Cream,"Creamy and delicious ice cream, available in various flavors for a delightful treat.",groceries,5.49,8.69,3.39,27,,GRO-BRD-CRE-028,1,1 month warranty,Ships in 2 weeks,In Stock,No return policy,42
29,Juice,"Refreshing fruit juice, packed with vitamins and great for staying hydrated.",groceries,3.99,12.06,3.94,50,,GRO-BRD-JUI-029,1,6 months warranty,Ships in 1 week,In Stock,No return policy,25
30,Kiwi,"Nutrient-rich kiwi, perfect for snacking or adding a tropical twist to your dishes.",groceries,2.49,15.22,4.93,99,,GRO-BRD-KIW-030,5,6 months warranty,Ships overnight,In Stock,7 days return policy,30
31,Lemon,"Zesty and tangy lemons, versatile for cooking, baking, or making refreshing beverages.",groceries,0.79,9.7,3.53,31,,GRO-BRD-LEM-031,3,No warranty,Ships in 1 month,In Stock,7 days return policy,29
32,Milk,"Fresh and nutritious milk, a staple for various recipes and daily consumption.",groceries,3.49,13.74,2.61,27,,GRO-BRD-MIL-032,5,3 year warranty,Ships in 2 weeks,In Stock,7 days return policy,5
33,Mulberry,"Sweet and juicy mulberries, perfect for snacking or adding to desserts and cereals.",groceries,4.99,12.87,4.95,99,,GRO-BRD-MUL-033,5,2 year warranty,Ships in 1 week,In Stock,No return policy,43
34,Nescafe Coffee,"Quality coffee from Nescafe, available in various blends for a rich and satisfying cup.",groceries,7.99,1.59,4.82,57,,GRO-BRD-NES-034,6,1 year warranty,Ships in 1-2 business days,In Stock,30 days return policy,8
35,Potatoes,"Versatile and starchy potatoes, great for roasting, mashing, or as a side dish.",groceries,2.29,5.38,4.81,13,,GRO-BRD-POT-035,9,3 year warranty,Ships in 3-5 business days,In Stock,90 days return policy,9
36,Protein Powder,"Nutrient-packed protein powder, ideal for supplementing your diet with essential proteins.",groceries,19.99,7.59,4.18,80,,GRO-BRD-PRO-036,9,1 week warranty,Ships in 1 month,In Stock,No return policy,6
37,Red Onions,"Flavorful and aromatic red onions, perfect for adding depth to your savory dishes.",groceries,1.99,9.9,4.2,82,,GRO-BRD-ONI-037,9,1 month warranty,Ships in 3-5 business days,In Stock,7 days return policy,8
38,Rice,"High-quality rice, a staple for various cuisines and a versatile base for many dishes.",groceries,5.99,9.29,3.18,59,,GRO-BRD-RIC-038,5,6 months warranty,Ships overnight,In Stock,No return policy,20
39,Soft Drinks,"Assorted soft drinks in various flavors, perfect for refreshing beverages.",groceries,1.99,17.48,4.75,53,,GRO-BRD-SOF-039,9,6 months warranty,Ships in 2 weeks,In Stock,7 days return policy,10
40,Strawberry,"Sweet and succulent strawberries, great for snacking, desserts, or blending into smoothies.",groceries,3.99,1.12,3.08,46,,GRO-BRD-STR-040,1,1 week warranty,Ships in 1-2 business days,In Stock,No return policy,12
41,Tissue Paper Box,"Convenient tissue paper box for everyday use, providing soft and absorbent tissues.",groceries,2.49,13.28,2.69,86,,GRO-BRD-TIS-041,1,No warranty,Ships in 1-2 business days,In Stock,90 days return policy,44
42,Water,"Pure and refreshing bottled water, essential for staying hydrated throughout the day.",groceries,0.99,14.92,4.96,53,,GRO-BRD-WAT-042,4,3 months warranty,Ships in 1 month,In Stock,7 days return policy,28
43,Decoration Swing,"The Decoration Swing is a charming addition to your home decor. Crafted with intricate details, it adds a touch of elegance and whimsy to any room.",home-decoration,59.99,10.41,3.16,47,,HOM-BRD-DEC-043,4,1 week warranty,Ships in 1 month,In Stock,90 days return policy,8
44,Family Tree Photo Frame,"The Family Tree Photo Frame is a sentimental and stylish way to display your cherished family memories. With multiple photo slots, it tells the story of your loved ones.",home-decoration,29.99,14.87,4.53,77,,HOM-BRD-FAM-044,1,1 month warranty,Ships in 2 weeks,In Stock,No return policy,15
45,House Showpiece Plant,The House Showpiece Plant is an artificial plant that brings a touch of nature to your home without the need for maintenance. It adds greenery and style to any space.,home-decoration,39.99,7.46,4.67,28,,HOM-BRD-HOU-045,8,1 year warranty,Ships in 1 week,In Stock,No return policy,3
46,Plant Pot,"The Plant Pot is a stylish container for your favorite plants. With a sleek design, it complements your indoor or outdoor garden, adding a modern touch to your plant display.",home-decoration,14.99,6.84,3.01,59,,HOM-BRD-PLA-046,9,Lifetime warranty,Ships in 3-5 business days,In Stock,30 days return policy,31
47,Table Lamp,"The Table Lamp is a functional and decorative lighting solution for your living space. With a modern design, it provides both ambient and task lighting, enhancing the atmosphere.",home-decoration,49.99,7.09,3.55,9,,HOM-BRD-TAB-047,4,3 months warranty,Ships in 1-2 business days,In Stock,90 days return policy,2
48,Bamboo Spatula,"The Bamboo Spatula is a versatile kitchen tool made from eco-friendly bamboo. Ideal for flipping, stirring, and serving various dishes.",kitchen-accessories,7.99,2.84,3.27,37,,KIT-BRD-BAM-048,3,1 month warranty,Ships overnight,In Stock,60 days return policy,29
49,Black Aluminium Cup,The Black Aluminium Cup is a stylish and durable cup suitable for both hot and cold beverages. Its sleek black design adds a modern touch to your drinkware collection.,kitchen-accessories,5.99,15.65,4.46,75,,KIT-BRD-BLA-049,7,1 year warranty,Ships overnight,In Stock,30 days return policy,48
50,Black Whisk,The Black Whisk is a kitchen essential for whisking and beating ingredients. Its ergonomic handle and sleek design make it a practical and stylish tool.,kitchen-accessories,9.99,10.24,3.9,73,,KIT-BRD-BLA-050,1,3 months warranty,Ships in 1 month,In Stock,30 days return policy,40
51,Boxed Blender,"The Boxed Blender is a powerful and compact blender perfect for smoothies, shakes, and more. Its convenient design and multiple functions make it a versatile kitchen appliance.",kitchen-accessories,39.99,7.26,4.56,9,,KIT-BRD-BOX-051,1,5 year warranty,Ships in 1-2 business days,In Stock,7 days return policy,4
52,Carbon Steel Wok,"The Carbon Steel Wok is a versatile cooking pan suitable for stir-frying, sautéing, and deep frying. Its sturdy construction ensures even heat distribution for delicious meals.",kitchen-accessories,29.99,6.53,4.05,40,,KIT-BRD-CAR-052,2,2 year warranty,Ships in 1-2 business days,In Stock,7 days return policy,9
53,Chopping Board,"The Chopping Board is an essential kitchen accessory for food preparation. Made from durable material, it provides a safe and hygienic surface for cutting and chopping.",kitchen-accessories,12.99,8.03,3.7,14,,KIT-BRD-CHO-053,2,3 months warranty,Ships in 2 weeks,In Stock,No return policy,5
54,Citrus Squeezer Yellow,The Citrus Squeezer in Yellow is a handy tool for extracting juice from citrus fruits. Its vibrant color adds a cheerful touch to your kitchen gadgets.,kitchen-accessories,8.99,12.1,4.63,22,,KIT-BRD-CIT-054,2,2 year warranty,Ships in 3-5 business days,In Stock,60 days return policy,38
55,Egg Slicer,"The Egg Slicer is a convenient tool for slicing boiled eggs evenly. It's perfect for salads, sandwiches, and other dishes where sliced eggs are desired.",kitchen-accessories,6.99,14.76,3.09,40,,KIT-BRD-SLI-055,2,1 week warranty,Ships in 1 month,In Stock,No return policy,32
56,Electric Stove,The Electric Stove provides a portable and efficient cooking solution. Ideal for small kitchens or as an additional cooking surface for various culinary needs.,kitchen-accessories,49.99,14.04,4.11,21,,KIT-BRD-ELE-056,5,2 year warranty,Ships in 1 week,In Stock,7 days return policy,8
57,Fine Mesh Strainer,The Fine Mesh Strainer is a versatile tool for straining liquids and sifting dry ingredients. Its fine mesh ensures efficient filtering for smooth cooking and baking.,kitchen-accessories,9.99,3.5,3.04,85,,KIT-BRD-FIN-057,9,1 month warranty,Ships overnight,In Stock,7 days return policy,43
58,Fork,The Fork is a classic utensil for various dining and serving purposes. Its durable and ergonomic design makes it a reliable choice for everyday use.,kitchen-accessories,3.99,8.07,3.11,7,,KIT-BRD-FOR-058,9,No warranty,Ships in 1 month,In Stock,No return policy,36
59,Glass,The Glass is a versatile and elegant drinking vessel suitable for a variety of beverages. Its clear design allows you to enjoy the colors and textures of your drinks.,kitchen-accessories,4.99,7.92,4.02,46,,KIT-BRD-GLA-059,10,3 year warranty,Ships overnight,In Stock,7 days return policy,17
60,Grater Black,"The Grater in Black is a handy kitchen tool for grating cheese, vegetables, and more. Its sleek design and sharp blades make food preparation efficient and easy.",kitchen-accessories,10.99,3.56,3.21,84,,KIT-BRD-GRA-060,3,1 month warranty,Ships in 1 week,In Stock,60 days return policy,5
61,Hand Blender,"The Hand Blender is a versatile kitchen appliance for blending, pureeing, and mixing. Its compact design and powerful motor make it a convenient tool for various recipes.",kitchen-accessories,34.99,17.02,3.86,84,,KIT-BRD-HAN-061,5,1 year warranty,Ships in 1 week,In Stock,No return policy,11
62,Ice Cube Tray,The Ice Cube Tray is a practical accessory for making ice cubes in various shapes. Perfect for keeping your drinks cool and adding a fun element to your beverages.,kitchen-accessories,5.99,0.63,4.71,13,,KIT-BRD-CUB-062,3,1 month warranty,Ships overnight,In Stock,No return policy,16
63,Kitchen Sieve,The Kitchen Sieve is a versatile tool for sifting and straining dry and wet ingredients. Its fine mesh design ensures smooth results in your cooking and baking.,kitchen-accessories,7.99,18.91,3.09,68,,KIT-BRD-KIT-063,5,1 month warranty,Ships overnight,In Stock,No return policy,5
64,Knife,"The Knife is an essential kitchen tool for chopping, slicing, and dicing. Its sharp blade and ergonomic handle make it a reliable choice for food preparation.",kitchen-accessories,14.99,18.86,3.26,7,,KIT-BRD-KNI-064,3,1 month warranty,Ships in 1 week,Low Stock,7 days return policy,50
65,Lunch Box,"The Lunch Box is a convenient and portable container for packing and carrying your meals. With compartments for different foods, it's perfect for on-the-go dining.",kitchen-accessories,12.99,10.34,4.93,94,,KIT-BRD-LUN-065,9,5 year warranty,Ships in 1-2 business days,In Stock,30 days return policy,39
66,Microwave Oven,"The Microwave Oven is a versatile kitchen appliance for quick and efficient cooking, reheating, and defrosting. Its compact size makes it suitable for various kitchen setups.",kitchen-accessories,89.99,12.13,4.82,59,,KIT-BRD-MIC-066,9,1 year warranty,Ships in 1 week,In Stock,7 days return policy,4
67,Mug Tree Stand,The Mug Tree Stand is a stylish and space-saving solution for organizing your mugs. Keep your favorite mugs easily accessible and neatly displayed in your kitchen.,kitchen-accessories,15.99,9.25,2.64,88,,KIT-BRD-TRE-067,3,1 year warranty,Ships in 1 month,In Stock,30 days return policy,45
68,Pan,"The Pan is a versatile and essential cookware item for frying, sautéing, and cooking various dishes. Its non-stick coating ensures easy food release and cleanup.",kitchen-accessories,24.99,3.0,2.79,90,,KIT-BRD-PRD-068,8,1 year warranty,Ships in 3-5 business days,In Stock,30 days return policy,17
69,Plate,The Plate is a classic and essential dishware item for serving meals. Its durable and stylish design makes it suitable for everyday use or special occasions.,kitchen-accessories,3.99,7.31,3.65,66,,KIT-BRD-PLA-069,4,1 year warranty,Ships in 1-2 business days,In Stock,90 days return policy,6
70,Red Tongs,The Red Tongs are versatile kitchen tongs suitable for various cooking and serving tasks. Their vibrant color adds a pop of excitement to your kitchen utensils.,kitchen-accessories,6.99,14.52,4.42,82,,KIT-BRD-TON-070,7,No warranty,Ships in 1 week,In Stock,30 days return policy,23
71,Silver Pot With Glass Cap,"The Silver Pot with Glass Cap is a stylish and functional cookware item for boiling, simmering, and preparing delicious meals. Its glass cap allows you to monitor cooking progress.",kitchen-accessories,39.99,5.7,3.22,40,,KIT-BRD-SIL-071,7,1 year warranty,Ships in 1 month,In Stock,90 days return policy,10
72,Slotted Turner,"The Slotted Turner is a kitchen utensil designed for flipping and turning food items. Its slotted design allows excess liquid to drain, making it ideal for frying and sautéing.",kitchen-accessories,8.99,13.35,3.4,88,,KIT-BRD-SLO-072,8,Lifetime warranty,Ships in 1-2 business days,In Stock,7 days return policy,34
73,Spice Rack,The Spice Rack is a convenient organizer for your spices and seasonings. Keep your kitchen essentials within reach and neatly arranged with this stylish spice rack.,kitchen-accessories,19.99,12.09,4.87,79,,KIT-BRD-SPI-073,7,1 week warranty,Ships overnight,In Stock,7 days return policy,18
74,Spoon,"The Spoon is a versatile kitchen utensil for stirring, serving, and tasting. Its ergonomic design and durable construction make it an essential tool for every kitchen.",kitchen-accessories,4.99,1.53,4.03,59,,KIT-BRD-SPO-074,6,1 year warranty,Ships in 1-2 business days,In Stock,90 days return policy,15
75,Tray,"The Tray is a functional and decorative item for serving snacks, appetizers, or drinks. Its stylish design makes it a versatile accessory for entertaining guests.",kitchen-accessories,16.99,7.48,4.62,71,,KIT-BRD-TRA-075,10,5 year warranty,Ships in 2 weeks,In Stock,7 days return policy,23
76,Wooden Rolling Pin,The Wooden Rolling Pin is a classic kitchen tool for rolling out dough for baking. Its smooth surface and sturdy handles make it easy to achieve uniform thickness.,kitchen-accessories,11.99,9.75,2.92,80,,KIT-BRD-WOO-076,7,3 year warranty,Ships in 2 weeks,In Stock,30 days return policy,11
77,Yellow Peeler,The Yellow Peeler is a handy tool for peeling fruits and vegetables with ease. Its bright yellow color adds a cheerful touch to your kitchen gadgets.,kitchen-accessories,5.99,12.48,4.24,35,,KIT-BRD-YEL-077,7,1 month warranty,Ships in 3-5 business days,In Stock,90 days return policy,6
78,Apple MacBook Pro 14 Inch Space Grey,"The MacBook Pro 14 Inch in Space Grey is a powerful and sleek laptop, featuring Apple's M1 Pro chip for exceptional performance and a stunning Retina display.",laptops,1999.99,4.69,3.65,24,Apple,LAP-APP-APP-078,9,3 year warranty,Ships in 2 weeks,In Stock,90 days return policy,1
79,Asus Zenbook Pro Dual Screen Laptop,"The Asus Zenbook Pro Dual Screen Laptop is a high-performance device with dual screens, providing productivity and versatility for creative professionals.",laptops,1799.99,11.14,3.95,45,Asus,LAP-ASU-ASU-079,9,3 year warranty,Ships in 1 month,In Stock,7 days return policy,1
80,Huawei Matebook X Pro,"The Huawei Matebook X Pro is a slim and stylish laptop with a high-resolution touchscreen display, offering a premium experience for users on the go.",laptops,1399.99,9.38,4.98,75,Huawei,LAP-HUA-HUA-080,9,No warranty,Ships overnight,In Stock,60 days return policy,1
81,Lenovo Yoga 920,"The Lenovo Yoga 920 is a 2-in-1 convertible laptop with a flexible hinge, allowing you to use it as a laptop or tablet, offering versatility and portability.",laptops,1099.99,6.55,2.86,40,Lenovo,LAP-LEN-LEN-081,9,6 months warranty,Ships in 2 weeks,In Stock,No return policy,1
82,New DELL XPS 13 9300 Laptop,"The New DELL XPS 13 9300 Laptop is a compact and powerful device, featuring a virtually borderless InfinityEdge display and high-end performance for various tasks.",laptops,1499.99,11.89,2.67,74,Dell,LAP-DEL-DEL-082,2,2 year warranty,Ships in 2 weeks,In Stock,60 days return policy,1
83,Blue & Black Check Shirt,"The Blue & Black Check Shirt is a stylish and comfortable men's shirt featuring a classic check pattern. Made from high-quality fabric, it's suitable for both casual and semi-formal occasions.",mens-shirts,29.99,15.35,3.64,38,Fashion Trends,MEN-FAS-BLU-083,4,3 year warranty,Ships in 3-5 business days,In Stock,30 days return policy,18
84,Gigabyte Aorus Men Tshirt,"The Gigabyte Aorus Men Tshirt is a cool and casual shirt for gaming enthusiasts. With the Aorus logo and sleek design, it's perfect for expressing your gaming style.",mens-shirts,24.99,0.94,3.18,90,Gigabyte,MEN-GIG-GIG-084,4,3 year warranty,Ships overnight,In Stock,30 days return policy,16
85,Man Plaid Shirt,The Man Plaid Shirt is a timeless and versatile men's shirt with a classic plaid pattern. Its comfortable fit and casual style make it a wardrobe essential for various occasions.,mens-shirts,34.99,19.5,3.46,82,Classic Wear,MEN-CLA-PLA-085,3,1 week warranty,Ships in 1-2 business days,In Stock,7 days return policy,13
86,Man Short Sleeve Shirt,"The Man Short Sleeve Shirt is a breezy and stylish option for warm days. With a comfortable fit and short sleeves, it's perfect for a laid-back yet polished look.",mens-shirts,19.99,6.83,2.9,2,Casual Comfort,MEN-CAS-SHO-086,2,3 year warranty,Ships in 2 weeks,Low Stock,30 days return policy,4
87,Men Check Shirt,"The Men Check Shirt is a classic and versatile shirt featuring a stylish check pattern. Suitable for various occasions, it adds a smart and polished touch to your wardrobe.",mens-shirts,27.99,11.38,2.72,95,Urban Chic,MEN-URB-CHE-087,10,No warranty,Ships in 1-2 business days,In Stock,30 days return policy,12
88,Nike Air Jordan 1 Red And Black,"The Nike Air Jordan 1 in Red and Black is an iconic basketball sneaker known for its stylish design and high-performance features, making it a favorite among sneaker enthusiasts and athletes.",mens-shoes,149.99,4.12,4.77,7,Nike,MEN-NIK-NIK-088,3,1 year warranty,Ships in 1 week,In Stock,No return policy,1
89,Nike Baseball Cleats,Nike Baseball Cleats are designed for maximum traction and performance on the baseball field. They provide stability and support for players during games and practices.,mens-shoes,79.99,18.04,3.88,12,Nike,MEN-NIK-NIK-089,9,6 months warranty,Ships in 2 weeks,In Stock,No return policy,3
90,Puma Future Rider Trainers,"The Puma Future Rider Trainers offer a blend of retro style and modern comfort. Perfect for casual wear, these trainers provide a fashionable and comfortable option for everyday use.",mens-shoes,89.99,4.2,4.9,90,Puma,MEN-PUM-PUM-090,6,5 year warranty,Ships in 1-2 business days,In Stock,90 days return policy,10
