id,title,description,category,price,discountPercentage,rating,stock,brand,sku,weight,warrantyInformation,shippingInformation,availabilityStatus,returnPolicy,minimumOrderQuantity
91,Sports Sneakers Off White & Red,"The Sports Sneakers in Off White and Red combine style and functionality, making them a fashionable choice for sports enthusiasts. The red and off-white color combination adds a bold and energetic touch.",mens-shoes,119.99,4.97,4.77,17,Off White,MEN-OFF-SPO-091,7,1 week warranty,Ships in 3-5 business days,In Stock,30 days return policy,5
92,Sports Sneakers Off White Red,"Another variant of the Sports Sneakers in Off White Red, featuring a unique design. These sneakers offer style and comfort for casual occasions.",mens-shoes,109.99,0.04,4.69,62,Off White,MEN-OFF-SPO-092,9,3 months warranty,Ships overnight,In Stock,60 days return policy,3
93,Brown Leather Belt Watch,"The Brown Leather Belt Watch is a stylish timepiece with a classic design. Featuring a genuine leather strap and a sleek dial, it adds a touch of sophistication to your look.",mens-watches,89.99,5.99,4.19,32,Fashion Timepieces,MEN-FAS-BRO-093,10,1 year warranty,Ships in 1 month,In Stock,30 days return policy,7
94,Longines Master Collection,"The Longines Master Collection is an elegant and refined watch known for its precision and craftsmanship. With a timeless design, it's a symbol of luxury and sophistication.",mens-watches,1499.99,17.24,3.87,100,Longines,MEN-LON-LON-094,4,1 week warranty,Ships in 1-2 business days,In Stock,7 days return policy,1
95,Rolex Cellini Date Black Dial,"The Rolex Cellini Date with Black Dial is a classic and prestigious watch. With a black dial and date complication, it exudes sophistication and is a symbol of Rolex's heritage.",mens-watches,8999.99,8.88,4.97,40,Rolex,MEN-ROL-ROL-095,2,3 months warranty,Ships in 1 week,In Stock,90 days return policy,1
96,Rolex Cellini Moonphase,"The Rolex Cellini Moonphase is a masterpiece of horology, featuring a moon phase complication and exquisite design. It reflects Rolex's commitment to precision and elegance.",mens-watches,12999.99,17.52,2.58,36,Rolex,MEN-ROL-ROL-096,2,6 months warranty,Ships overnight,In Stock,7 days return policy,1
97,Rolex Datejust,"The Rolex Datejust is an iconic and versatile timepiece with a date window. Known for its timeless design and reliability, it's a symbol of Rolex's watchmaking excellence.",mens-watches,10999.99,3.73,3.66,86,Rolex,MEN-ROL-ROL-097,4,2 year warranty,Ships in 1 month,In Stock,7 days return policy,1
98,Rolex Submariner Watch,"The Rolex Submariner is a legendary dive watch with a rich history. Known for its durability and water resistance, it's a symbol of adventure and exploration.",mens-watches,13999.99,5.05,2.69,55,Rolex,MEN-ROL-ROL-098,4,5 year warranty,Ships in 1 month,In Stock,90 days return policy,1
99,Amazon Echo Plus,The Amazon Echo Plus is a smart speaker with built-in Alexa voice control. It features premium sound quality and serves as a hub for controlling smart home devices.,mobile-accessories,99.99,12.07,4.99,61,Amazon,MOB-AMA-AMA-099,5,6 months warranty,Ships in 1 week,In Stock,7 days return policy,9
100,Apple Airpods,"The Apple Airpods offer a seamless wireless audio experience. With easy pairing, high-quality sound, and Siri integration, they are perfect for on-the-go listening.",mobile-accessories,129.99,15.54,4.15,67,Apple,MOB-APP-APP-100,4,3 year warranty,Ships in 3-5 business days,In Stock,No return policy,4
101,Apple AirPods Max Silver,"The Apple AirPods Max in Silver are premium over-ear headphones with high-fidelity audio, adaptive EQ, and active noise cancellation. Experience immersive sound in style.",mobile-accessories,549.99,13.67,3.47,59,Apple,MOB-APP-APP-101,2,No warranty,Ships in 2 weeks,In Stock,No return policy,1
102,Apple Airpower Wireless Charger,The Apple AirPower Wireless Charger provides a convenient way to charge your compatible Apple devices wirelessly. Simply place your devices on the charging mat for effortless charging.,mobile-accessories,79.99,4.48,3.68,1,Apple,MOB-APP-APP-102,5,2 year warranty,Ships in 1 week,Low Stock,90 days return policy,7
103,Apple HomePod Mini Cosmic Grey,The Apple HomePod Mini in Cosmic Grey is a compact smart speaker that delivers impressive audio and integrates seamlessly with the Apple ecosystem for a smart home experience.,mobile-accessories,99.99,18.1,4.62,27,Apple,MOB-APP-APP-103,10,3 months warranty,Ships in 1 month,In Stock,90 days return policy,8
104,Apple iPhone Charger,The Apple iPhone Charger is a high-quality charger designed for fast and efficient charging of your iPhone. Ensure your device stays powered up and ready to go.,mobile-accessories,19.99,18.52,4.15,31,Apple,MOB-APP-APP-104,1,1 year warranty,Ships in 2 weeks,In Stock,90 days return policy,14
105,Apple MagSafe Battery Pack,The Apple MagSafe Battery Pack is a portable and convenient way to add extra battery life to your MagSafe-compatible iPhone. Attach it magnetically for a secure connection.,mobile-accessories,99.99,17.17,3.62,1,Apple,MOB-APP-APP-105,6,2 year warranty,Ships overnight,Low Stock,No return policy,4
106,Apple Watch Series 4 Gold,"The Apple Watch Series 4 in Gold is a stylish and advanced smartwatch with features like heart rate monitoring, fitness tracking, and a beautiful Retina display.",mobile-accessories,349.99,12.02,2.74,33,Apple,MOB-APP-APP-106,6,6 months warranty,Ships in 1 month,In Stock,No return policy,3
107,Beats Flex Wireless Earphones,"The Beats Flex Wireless Earphones offer a comfortable and versatile audio experience. With magnetic earbuds and up to 12 hours of battery life, they are ideal for everyday use.",mobile-accessories,49.99,5.73,4.24,50,Beats,MOB-BEA-BEA-107,8,1 year warranty,Ships in 1-2 business days,In Stock,7 days return policy,17
108,iPhone 12 Silicone Case with MagSafe Plum,The iPhone 12 Silicone Case with MagSafe in Plum is a stylish and protective case designed for the iPhone 12. It features MagSafe technology for easy attachment of accessories.,mobile-accessories,29.99,13.85,3.62,69,Apple,MOB-APP-IPH-108,7,3 months warranty,Ships in 3-5 business days,In Stock,90 days return policy,4
109,Monopod,"The Monopod is a versatile camera accessory for stable and adjustable shooting. Perfect for capturing selfies, group photos, and videos with ease.",mobile-accessories,19.99,8.58,4.43,48,TechGear,MOB-TEC-MON-109,10,1 year warranty,Ships in 1-2 business days,In Stock,60 days return policy,30
110,Selfie Lamp with iPhone,The Selfie Lamp with iPhone is a portable and adjustable LED light designed to enhance your selfies and video calls. Attach it to your iPhone for well-lit photos.,mobile-accessories,14.99,19.4,3.55,58,GadgetMaster,MOB-GAD-SEL-110,10,Lifetime warranty,Ships in 2 weeks,In Stock,60 days return policy,22
111,Selfie Stick Monopod,The Selfie Stick Monopod is a extendable and foldable device for capturing the perfect selfie or group photo. Compatible with smartphones and cameras.,mobile-accessories,12.99,19.12,3.88,11,SnapTech,MOB-SNA-SEL-111,2,3 year warranty,Ships in 1-2 business days,In Stock,30 days return policy,8
112,TV Studio Camera Pedestal,The TV Studio Camera Pedestal is a professional-grade camera support system for smooth and precise camera movements in a studio setting. Ideal for broadcast and production.,mobile-accessories,499.99,8.31,2.78,15,ProVision,MOB-PRO-STU-112,4,3 months warranty,Ships in 1-2 business days,In Stock,7 days return policy,1
113,Generic Motorcycle,"The Generic Motorcycle is a versatile and reliable bike suitable for various riding preferences. With a balanced design, it provides a comfortable and efficient riding experience.",motorcycle,3999.99,12.1,4.91,34,Generic Motors,MOT-GEN-GEN-113,8,1 year warranty,Ships in 2 weeks,In Stock,7 days return policy,1
114,Kawasaki Z800,"The Kawasaki Z800 is a powerful and agile sportbike known for its striking design and performance. It's equipped with advanced features, making it a favorite among motorcycle enthusiasts.",motorcycle,8999.99,9.77,3.98,52,Kawasaki,MOT-KAW-KAW-114,9,Lifetime warranty,Ships in 3-5 business days,In Stock,90 days return policy,1
115,MotoGP CI.H1,The MotoGP CI.H1 is a high-performance motorcycle inspired by MotoGP racing technology. It offers cutting-edge features and precision engineering for an exhilarating riding experience.,motorcycle,14999.99,6.92,2.97,10,MotoGP,MOT-MOT-MOT-115,1,1 month warranty,Ships in 3-5 business days,In Stock,30 days return policy,1
116,Scooter Motorcycle,The Scooter Motorcycle is a practical and fuel-efficient bike ideal for urban commuting. It features a step-through design and user-friendly controls for easy maneuverability.,motorcycle,2999.99,6.27,2.53,84,ScootMaster,MOT-SCO-SCO-116,7,5 year warranty,Ships overnight,In Stock,7 days return policy,1
117,Sportbike Motorcycle,"The Sportbike Motorcycle is designed for speed and agility, with a sleek and aerodynamic profile. It's suitable for riders looking for a dynamic and thrilling riding experience.",motorcycle,7499.99,11.58,3.94,0,SpeedMaster,MOT-SPE-SPO-117,10,5 year warranty,Ships in 2 weeks,Out of Stock,30 days return policy,1
118,Attitude Super Leaves Hand Soap,"Attitude Super Leaves Hand Soap is a natural and nourishing hand soap enriched with the goodness of super leaves. It cleanses and moisturizes your hands, leaving them feeling fresh and soft.",skin-care,8.99,18.49,3.19,94,Attitude,SKI-ATT-ATT-118,1,6 months warranty,Ships overnight,In Stock,60 days return policy,41
119,Olay Ultra Moisture Shea Butter Body Wash,Olay Ultra Moisture Shea Butter Body Wash is a luxurious body wash that hydrates and nourishes your skin with the moisturizing power of shea butter. Enjoy a rich lather and silky-smooth skin.,skin-care,12.99,16.39,4.51,34,Olay,SKI-OLA-OLA-119,4,1 year warranty,Ships in 1-2 business days,In Stock,30 days return policy,33
120,Vaseline Men Body and Face Lotion,Vaseline Men Body and Face Lotion is a specially formulated lotion designed to provide long-lasting moisture to men's skin. It absorbs quickly and helps keep the skin hydrated and healthy.,skin-care,9.99,13.39,3.16,95,Vaseline,SKI-VAS-VAS-120,4,Lifetime warranty,Ships overnight,In Stock,90 days return policy,9
121,iPhone 5s,"The iPhone 5s is a classic smartphone known for its compact design and advanced features during its release. While it's an older model, it still provides a reliable user experience.",smartphones,199.99,12.91,2.83,25,Apple,SMA-APP-IPH-121,2,Lifetime warranty,Ships in 1 month,In Stock,60 days return policy,3
122,iPhone 6,"The iPhone 6 is a stylish and capable smartphone with a larger display and improved performance. It introduced new features and design elements, making it a popular choice in its time.",smartphones,299.99,6.69,3.41,60,Apple,SMA-APP-IPH-122,7,1 month warranty,Ships overnight,In Stock,7 days return policy,5
123,iPhone 13 Pro,"The iPhone 13 Pro is a cutting-edge smartphone with a powerful camera system, high-performance chip, and stunning display. It offers advanced features for users who demand top-notch technology.",smartphones,1099.99,9.37,4.12,56,Apple,SMA-APP-IPH-123,8,3 year warranty,Ships in 2 weeks,In Stock,7 days return policy,1
124,iPhone X,"The iPhone X is a flagship smartphone featuring a bezel-less OLED display, facial recognition technology (Face ID), and impressive performance. It represents a milestone in iPhone design and innovation.",smartphones,899.99,19.59,2.51,37,Apple,SMA-APP-IPH-124,1,3 months warranty,Ships in 3-5 business days,In Stock,7 days return policy,2
125,Oppo A57,"The Oppo A57 is a mid-range smartphone known for its sleek design and capable features. It offers a balance of performance and affordability, making it a popular choice.",smartphones,249.99,2.43,3.94,19,Oppo,SMA-OPP-OPP-125,5,Lifetime warranty,Ships in 3-5 business days,In Stock,90 days return policy,3
126,Oppo F19 Pro Plus,The Oppo F19 Pro Plus is a feature-rich smartphone with a focus on camera capabilities. It boasts advanced photography features and a powerful performance for a premium user experience.,smartphones,399.99,18.64,3.51,78,Oppo,SMA-OPP-OPP-126,6,3 year warranty,Ships in 1 week,In Stock,90 days return policy,1
127,Oppo K1,"The Oppo K1 series offers a range of smartphones with various features and specifications. Known for their stylish design and reliable performance, the Oppo K1 series caters to diverse user preferences.",smartphones,299.99,18.29,4.25,55,Oppo,SMA-OPP-OPP-127,5,1 month warranty,Ships in 1-2 business days,In Stock,30 days return policy,5
128,Realme C35,The Realme C35 is a budget-friendly smartphone with a focus on providing essential features for everyday use. It offers a reliable performance and user-friendly experience.,smartphones,149.99,15.3,4.2,48,Realme,SMA-REA-REA-128,2,3 year warranty,Ships overnight,In Stock,90 days return policy,3
129,Realme X,The Realme X is a mid-range smartphone known for its sleek design and impressive display. It offers a good balance of performance and camera capabilities for users seeking a quality device.,smartphones,299.99,6.95,3.7,12,Realme,SMA-REA-REA-129,4,1 month warranty,Ships in 3-5 business days,In Stock,No return policy,3
130,Realme XT,"The Realme XT is a feature-rich smartphone with a focus on camera technology. It comes equipped with advanced camera sensors, delivering high-quality photos and videos for photography enthusiasts.",smartphones,349.99,11.51,4.58,80,Realme,SMA-REA-REA-130,3,3 year warranty,Ships in 1 month,In Stock,60 days return policy,3
131,Samsung Galaxy S7,"The Samsung Galaxy S7 is a flagship smartphone known for its sleek design and advanced features. It features a high-resolution display, powerful camera, and robust performance.",smartphones,299.99,19.55,3.3,67,Samsung,SMA-SAM-SAM-131,10,3 months warranty,Ships in 3-5 business days,In Stock,No return policy,1
132,Samsung Galaxy S8,"The Samsung Galaxy S8 is a premium smartphone with an Infinity Display, offering a stunning visual experience. It boasts advanced camera capabilities and cutting-edge technology.",smartphones,499.99,19.45,4.4,0,Samsung,SMA-SAM-SAM-132,6,2 year warranty,Ships in 1 week,Out of Stock,No return policy,4
133,Samsung Galaxy S10,"The Samsung Galaxy S10 is a flagship device featuring a dynamic AMOLED display, versatile camera system, and powerful performance. It represents innovation and excellence in smartphone technology.",smartphones,699.99,5.59,3.06,19,Samsung,SMA-SAM-SAM-133,9,No warranty,Ships in 2 weeks,In Stock,30 days return policy,2
134,Vivo S1,"The Vivo S1 is a stylish and mid-range smartphone offering a blend of design and performance. It features a vibrant display, capable camera system, and reliable functionality.",smartphones,249.99,10.17,3.5,50,Vivo,SMA-VIV-VIV-134,4,6 months warranty,Ships in 3-5 business days,In Stock,7 days return policy,1
135,Vivo V9,"The Vivo V9 is a smartphone known for its sleek design and emphasis on capturing high-quality selfies. It features a notch display, dual-camera setup, and a modern design.",smartphones,299.99,17.67,3.6,82,Vivo,SMA-VIV-VIV-135,4,2 year warranty,Ships in 1 month,In Stock,60 days return policy,2
136,Vivo X21,"The Vivo X21 is a premium smartphone with a focus on cutting-edge technology. It features an in-display fingerprint sensor, a high-resolution display, and advanced camera capabilities.",smartphones,499.99,17.41,4.26,7,Vivo,SMA-VIV-VIV-136,10,1 year warranty,Ships in 1-2 business days,In Stock,60 days return policy,3
137,American Football,"The American Football is a classic ball used in American football games. It is designed for throwing and catching, making it an essential piece of equipment for the sport.",sports-accessories,19.99,4.93,4.91,53,,SPO-BRD-AME-137,2,6 months warranty,Ships in 1 month,In Stock,90 days return policy,1
138,Baseball Ball,"The Baseball Ball is a standard baseball used in baseball games. It features a durable leather cover and is designed for pitching, hitting, and fielding in the game of baseball.",sports-accessories,8.99,1.71,2.57,100,,SPO-BRD-BAS-138,5,6 months warranty,Ships in 1 week,In Stock,30 days return policy,11
139,Baseball Glove,"The Baseball Glove is a protective glove worn by baseball players. It is designed to catch and field the baseball, providing players with comfort and control during the game.",sports-accessories,24.99,2.9,3.96,22,,SPO-BRD-BAS-139,1,Lifetime warranty,Ships in 2 weeks,In Stock,90 days return policy,8
140,Basketball,"The Basketball is a standard ball used in basketball games. It is designed for dribbling, shooting, and passing in the game of basketball, suitable for both indoor and outdoor play.",sports-accessories,14.99,7.44,4.66,75,,SPO-BRD-BAS-140,7,1 year warranty,Ships in 1 week,In Stock,90 days return policy,11
141,Basketball Rim,The Basketball Rim is a sturdy hoop and net assembly mounted on a basketball backboard. It provides a target for shooting and scoring in the game of basketball.,sports-accessories,39.99,7.74,4.6,43,,SPO-BRD-BAS-141,1,3 months warranty,Ships overnight,In Stock,No return policy,9
142,Cricket Ball,"The Cricket Ball is a hard leather ball used in the sport of cricket. It is bowled and batted in the game, and its hardness and seam contribute to the dynamics of cricket play.",sports-accessories,12.99,8.63,3.53,30,,SPO-BRD-CRI-142,7,3 year warranty,Ships in 3-5 business days,In Stock,7 days return policy,11
143,Cricket Bat,The Cricket Bat is an essential piece of cricket equipment used by batsmen to hit the cricket ball. It is made of wood and comes in various sizes and designs.,sports-accessories,29.99,3.29,3.17,98,,SPO-BRD-CRI-143,10,1 year warranty,Ships in 1-2 business days,In Stock,No return policy,16
144,Cricket Helmet,"The Cricket Helmet is a protective headgear worn by cricket players, especially batsmen and wicketkeepers. It provides protection against fast bowling and bouncers.",sports-accessories,44.99,9.64,4.69,10,,SPO-BRD-CRI-144,10,Lifetime warranty,Ships overnight,In Stock,60 days return policy,4
145,Cricket Wicket,"The Cricket Wicket is a set of three stumps and two bails, forming a wicket used in the sport of cricket. Batsmen aim to protect the wicket while scoring runs.",sports-accessories,29.99,16.93,4.73,25,,SPO-BRD-CRI-145,5,3 months warranty,Ships overnight,In Stock,No return policy,20
146,Feather Shuttlecock,"The Feather Shuttlecock is used in the sport of badminton. It features natural feathers and is designed for high-speed play, providing stability and accuracy during matches.",sports-accessories,5.99,2.95,2.85,95,,SPO-BRD-FEA-146,4,3 year warranty,Ships in 1-2 business days,In Stock,60 days return policy,30
147,Football,"The Football, also known as a soccer ball, is the standard ball used in the sport of football (soccer). It is designed for kicking and passing in the game.",sports-accessories,17.99,5.15,3.28,96,,SPO-BRD-FOO-147,1,Lifetime warranty,Ships overnight,In Stock,7 days return policy,27
148,Golf Ball,"The Golf Ball is a small ball used in the sport of golf. It features dimples on its surface, providing aerodynamic lift and distance when struck by a golf club.",sports-accessories,9.99,17.37,4.3,84,,SPO-BRD-GOL-148,3,1 year warranty,Ships in 3-5 business days,In Stock,No return policy,40
149,Iron Golf,"The Iron Golf is a type of golf club designed for various golf shots. It features a solid metal head and is used for approach shots, chipping, and other golfing techniques.",sports-accessories,49.99,6.53,4.41,90,,SPO-BRD-IRO-149,2,3 months warranty,Ships in 2 weeks,In Stock,7 days return policy,8
150,Metal Baseball Bat,The Metal Baseball Bat is a durable and lightweight baseball bat made from metal alloys. It is commonly used in baseball games for hitting and batting practice.,sports-accessories,29.99,19.51,4.66,16,,SPO-BRD-MET-150,7,3 year warranty,Ships in 1 week,In Stock,60 days return policy,9
151,Tennis Ball,The Tennis Ball is a standard ball used in the sport of tennis. It is designed for bouncing and hitting with tennis rackets during matches or practice sessions.,sports-accessories,6.99,11.76,4.06,28,,SPO-BRD-TEN-151,3,5 year warranty,Ships in 1 week,In Stock,7 days return policy,6
152,Tennis Racket,"The Tennis Racket is an essential piece of equipment used in the sport of tennis. It features a frame with strings and a grip, allowing players to hit the tennis ball.",sports-accessories,49.99,19.61,4.03,6,,SPO-BRD-TEN-152,7,5 year warranty,Ships overnight,Low Stock,7 days return policy,5
153,Volleyball,"The Volleyball is a standard ball used in the sport of volleyball. It is designed for passing, setting, and spiking over the net during volleyball matches.",sports-accessories,11.99,12.25,3.84,0,,SPO-BRD-VOL-153,3,1 week warranty,Ships in 1 week,Out of Stock,90 days return policy,44
154,Black Sun Glasses,"The Black Sun Glasses are a classic and stylish choice, featuring a sleek black frame and tinted lenses. They provide both UV protection and a fashionable look.",sunglasses,29.99,4.94,4.41,60,Fashion Shades,SUN-FAS-BLA-154,1,No warranty,Ships in 1-2 business days,In Stock,7 days return policy,17
155,Classic Sun Glasses,The Classic Sun Glasses offer a timeless design with a neutral frame and UV-protected lenses. These sunglasses are versatile and suitable for various occasions.,sunglasses,24.99,4.94,3.86,1,Fashion Shades,SUN-FAS-CLA-155,8,6 months warranty,Ships in 1 month,Low Stock,90 days return policy,18
156,Green and Black Glasses,"The Green and Black Glasses feature a bold combination of green and black colors, adding a touch of vibrancy to your eyewear collection. They are both stylish and eye-catching.",sunglasses,34.99,1.01,4.55,24,Fashion Shades,SUN-FAS-GRE-156,7,1 year warranty,Ships overnight,In Stock,30 days return policy,15
157,Party Glasses,"The Party Glasses are designed to add flair to your party outfit. With unique shapes or colorful frames, they're perfect for adding a playful touch to your look during celebrations.",sunglasses,19.99,11.22,2.79,86,Fashion Fun,SUN-FAS-PAR-157,9,3 months warranty,Ships overnight,In Stock,7 days return policy,39
158,Sunglasses,The Sunglasses offer a classic and simple design with a focus on functionality. These sunglasses provide essential UV protection while maintaining a timeless look.,sunglasses,22.99,1.51,3.02,27,Fashion Shades,SUN-FAS-SUN-158,1,3 year warranty,Ships in 3-5 business days,In Stock,60 days return policy,8
159,iPad Mini 2021 Starlight,"The iPad Mini 2021 in Starlight is a compact and powerful tablet from Apple. Featuring a stunning Retina display, powerful A-series chip, and a sleek design, it offers a premium tablet experience.",tablets,499.99,3.64,3.18,47,Apple,TAB-APP-IPA-159,5,2 year warranty,Ships in 1-2 business days,In Stock,No return policy,3
160,Samsung Galaxy Tab S8 Plus Grey,"The Samsung Galaxy Tab S8 Plus in Grey is a high-performance Android tablet by Samsung. With a large AMOLED display, powerful processor, and S Pen support, it's ideal for productivity and entertainment.",tablets,599.99,13.31,4.68,62,Samsung,TAB-SAM-SAM-160,1,3 months warranty,Ships in 2 weeks,In Stock,7 days return policy,1
161,Samsung Galaxy Tab White,"The Samsung Galaxy Tab in White is a sleek and versatile Android tablet. With a vibrant display, long-lasting battery, and a range of features, it offers a great user experience for various tasks.",tablets,349.99,18.2,3.72,92,Samsung,TAB-SAM-SAM-161,5,3 months warranty,Ships overnight,In Stock,7 days return policy,5
162,Blue Frock,"The Blue Frock is a charming and stylish dress for various occasions. With a vibrant blue color and a comfortable design, it adds a touch of elegance to your wardrobe.",tops,29.99,12.13,4.17,52,,TOP-BRD-BLU-162,5,Lifetime warranty,Ships in 2 weeks,In Stock,60 days return policy,4
163,Girl Summer Dress,"The Girl Summer Dress is a cute and breezy dress designed for warm weather. With playful patterns and lightweight fabric, it's perfect for keeping cool and stylish during the summer.",tops,19.99,19.2,4.77,43,,TOP-BRD-GIR-163,5,Lifetime warranty,Ships in 1 month,In Stock,60 days return policy,46
164,Gray Dress,"The Gray Dress is a versatile and chic option for various occasions. With a neutral gray color, it can be dressed up or down, making it a wardrobe staple for any fashion-forward individual.",tops,34.99,14.28,2.72,55,,TOP-BRD-GRA-164,1,1 month warranty,Ships in 1 month,In Stock,90 days return policy,13
165,Short Frock,"The Short Frock is a playful and trendy dress with a shorter length. Ideal for casual outings or special occasions, it combines style and comfort for a fashionable look.",tops,24.99,13.45,3.23,22,,TOP-BRD-SHO-165,10,1 year warranty,Ships in 1-2 business days,In Stock,30 days return policy,5
166,Tartan Dress,"The Tartan Dress features a classic tartan pattern, bringing a timeless and sophisticated touch to your wardrobe. Perfect for fall and winter, it adds a hint of traditional charm.",tops,39.99,12.95,4.05,73,,TOP-BRD-TAR-166,8,1 month warranty,Ships overnight,In Stock,No return policy,1
167,300 Touring,"The 300 Touring is a stylish and comfortable sedan, known for its luxurious features and smooth performance.",vehicle,28999.99,3.98,4.05,54,Chrysler,VEH-CHR-TOU-167,9,3 year warranty,Ships in 2 weeks,In Stock,30 days return policy,1
168,Charger SXT RWD,"The Charger SXT RWD is a powerful and sporty rear-wheel-drive sedan, offering a blend of performance and practicality.",vehicle,32999.99,8.23,2.58,57,Dodge,VEH-DOD-CHA-168,6,1 month warranty,Ships in 3-5 business days,In Stock,No return policy,1
169,Dodge Hornet GT Plus,"The Dodge Hornet GT Plus is a compact and agile hatchback, perfect for urban driving with a touch of sportiness.",vehicle,24999.99,2.63,2.65,82,Dodge,VEH-DOD-DOD-169,8,1 year warranty,Ships in 1 month,In Stock,60 days return policy,1
