id,title,description,category,price,discountPercentage,rating,stock,brand,sku,weight,warrantyInformation,shippingInformation,availabilityStatus,returnPolicy,minimumOrderQuantity
170,Durango SXT RWD,"The Durango SXT RWD is a spacious and versatile SUV, known for its strong performance and family-friendly features.",vehicle,36999.99,16.44,4.07,95,Dodge,VEH-DOD-DUR-170,1,2 year warranty,Ships in 1 month,In Stock,30 days return policy,1
171,Pacifica Touring,"The Pacifica Touring is a stylish and well-equipped minivan, offering comfort and convenience for family journeys.",vehicle,31999.99,14.76,3.62,53,Chrysler,VEH-CHR-PAC-171,9,1 month warranty,Ships overnight,In Stock,60 days return policy,1
172,Blue Women's Handbag,"The Blue Women's Handbag is a stylish and spacious accessory for everyday use. With a vibrant blue color and multiple compartments, it combines fashion and functionality.",womens-bags,49.99,17.88,2.92,76,Fashionista,WOM-FAS-BLU-172,7,1 year warranty,Ships in 1 week,In Stock,7 days return policy,5
173,Heshe Women's Leather Bag,"The Heshe Women's Leather Bag is a luxurious and high-quality leather bag for the sophisticated woman. With a timeless design and durable craftsmanship, it's a versatile accessory.",womens-bags,129.99,3.87,4.92,99,Heshe,WOM-HES-HES-173,3,5 year warranty,Ships overnight,In Stock,90 days return policy,5
174,Prada Women Bag,"The Prada Women Bag is an iconic designer bag that exudes elegance and luxury. Crafted with precision and featuring the Prada logo, it's a statement piece for fashion enthusiasts.",womens-bags,599.99,14.09,2.71,75,Prada,WOM-PRA-PRA-174,4,3 year warranty,Ships in 1-2 business days,In Stock,60 days return policy,1
175,White Faux Leather Backpack,"The White Faux Leather Backpack is a trendy and practical backpack for the modern woman. With a sleek white design and ample storage space, it's perfect for both casual and on-the-go styles.",womens-bags,39.99,15.2,3.36,39,Urban Chic,WOM-URB-WHI-175,7,2 year warranty,Ships in 1 week,In Stock,90 days return policy,7
176,Women Handbag Black,"The Women Handbag in Black is a classic and versatile accessory that complements various outfits. With a timeless black color and functional design, it's a must-have in every woman's wardrobe.",womens-bags,59.99,11.63,2.89,11,Elegance Collection,WOM-ELE-WOM-176,6,Lifetime warranty,Ships in 1 month,In Stock,60 days return policy,9
177,Black Women's Gown,"The Black Women's Gown is an elegant and timeless evening gown. With a sleek black design, it's perfect for formal events and special occasions, exuding sophistication and style.",womens-dresses,129.99,10.48,3.64,25,,WOM-BRD-BLA-177,2,Lifetime warranty,Ships in 1 week,In Stock,No return policy,5
178,Corset Leather With Skirt,"The Corset Leather With Skirt is a bold and edgy ensemble that combines a stylish corset with a matching skirt. Ideal for fashion-forward individuals, it makes a statement at any event.",womens-dresses,89.99,16.26,3.05,30,,WOM-BRD-COR-178,1,2 year warranty,Ships overnight,In Stock,30 days return policy,3
179,Corset With Black Skirt,The Corset With Black Skirt is a chic and versatile outfit that pairs a fashionable corset with a classic black skirt. It offers a trendy and coordinated look for various occasions.,womens-dresses,79.99,15.06,4.52,33,,WOM-BRD-COR-179,7,1 month warranty,Ships in 1 week,In Stock,No return policy,5
180,Dress Pea,"The Dress Pea is a stylish and comfortable dress with a pea pattern. Perfect for casual outings, it adds a playful and fun element to your wardrobe, making it a great choice for day-to-day wear.",womens-dresses,49.99,17.68,4.88,6,,WOM-BRD-DRE-180,1,2 year warranty,Ships overnight,Low Stock,90 days return policy,6
181,Marni Red & Black Suit,"The Marni Red & Black Suit is a sophisticated and fashion-forward suit ensemble. With a combination of red and black tones, it showcases a modern design for a bold and confident look.",womens-dresses,179.99,19.02,4.48,62,,WOM-BRD-MAR-181,3,5 year warranty,Ships in 2 weeks,In Stock,90 days return policy,2
182,Green Crystal Earring,"The Green Crystal Earring is a dazzling accessory that features a vibrant green crystal. With a classic design, it adds a touch of elegance to your ensemble, perfect for formal or special occasions.",womens-jewellery,29.99,15.24,3.96,54,,WOM-BRD-GRE-182,2,5 year warranty,Ships in 3-5 business days,In Stock,60 days return policy,15
183,Green Oval Earring,"The Green Oval Earring is a stylish and versatile accessory with a unique oval shape. Whether for casual or dressy occasions, its green hue and contemporary design make it a standout piece.",womens-jewellery,24.99,15.18,3.57,73,,WOM-BRD-GRE-183,10,3 months warranty,Ships in 3-5 business days,In Stock,60 days return policy,19
184,Tropical Earring,"The Tropical Earring is a fun and playful accessory inspired by tropical elements. Featuring vibrant colors and a lively design, it's perfect for adding a touch of summer to your look.",womens-jewellery,19.99,0.76,4.4,1,,WOM-BRD-TRO-184,3,3 year warranty,Ships in 1-2 business days,Low Stock,7 days return policy,31
185,Black & Brown Slipper,"The Black & Brown Slipper is a comfortable and stylish choice for casual wear. Featuring a blend of black and brown colors, it adds a touch of sophistication to your relaxation.",womens-shoes,19.99,3.33,2.53,3,Comfort Trends,WOM-COM-BLA-185,5,Lifetime warranty,Ships in 1 month,Low Stock,60 days return policy,47
186,Calvin Klein Heel Shoes,"Calvin Klein Heel Shoes are elegant and sophisticated, designed for formal occasions. With a classic design and high-quality materials, they complement your stylish ensemble.",womens-shoes,79.99,3.19,4.92,93,Calvin Klein,WOM-CAL-CAL-186,6,2 year warranty,Ships in 1 week,In Stock,60 days return policy,6
187,Golden Shoes Woman,"The Golden Shoes for Women are a glamorous choice for special occasions. Featuring a golden hue and stylish design, they add a touch of luxury to your outfit.",womens-shoes,49.99,13.93,3.26,88,Fashion Diva,WOM-FAS-GOL-187,4,6 months warranty,Ships in 2 weeks,In Stock,7 days return policy,7
188,Pampi Shoes,"Pampi Shoes offer a blend of comfort and style for everyday use. With a versatile design, they are suitable for various casual occasions, providing a trendy and relaxed look.",womens-shoes,29.99,14.14,3.05,49,Pampi,WOM-PAM-PAM-188,7,No warranty,Ships in 1 week,In Stock,60 days return policy,12
189,Red Shoes,"The Red Shoes make a bold statement with their vibrant red color. Whether for a party or a casual outing, these shoes add a pop of color and style to your wardrobe.",womens-shoes,34.99,17.69,3.25,7,Fashion Express,WOM-FAS-SHO-189,10,No warranty,Ships in 1 month,Low Stock,60 days return policy,8
190,IWC Ingenieur Automatic Steel,"The IWC Ingenieur Automatic Steel watch is a durable and sophisticated timepiece. With a stainless steel case and automatic movement, it combines precision and style for watch enthusiasts.",womens-watches,4999.99,9.45,2.93,90,IWC,WOM-IWC-ING-190,3,1 year warranty,Ships overnight,In Stock,No return policy,1
191,Rolex Cellini Moonphase,"The Rolex Cellini Moonphase watch is a masterpiece of horology. Featuring a moon phase complication, it showcases the craftsmanship and elegance that Rolex is renowned for.",womens-watches,15999.99,4.11,3.83,52,Rolex,WOM-ROL-ROL-191,10,1 month warranty,Ships in 1 week,In Stock,30 days return policy,1
192,Rolex Datejust Women,"The Rolex Datejust Women's watch is an iconic timepiece designed for women. With a timeless design and a date complication, it offers both elegance and functionality.",womens-watches,10999.99,15.94,2.86,4,Rolex,WOM-ROL-ROL-192,3,5 year warranty,Ships in 2 weeks,Low Stock,No return policy,1
193,Watch Gold for Women,"The Gold Women's Watch is a stunning accessory that combines luxury and style. Featuring a gold-plated case and a chic design, it adds a touch of glamour to any outfit.",womens-watches,799.99,18.34,4.24,0,Fashion Gold,WOM-FAS-WAT-193,1,2 year warranty,Ships in 1-2 business days,Out of Stock,60 days return policy,1
194,Women's Wrist Watch,"The Women's Wrist Watch is a versatile and fashionable timepiece for everyday wear. With a comfortable strap and a simple yet elegant design, it complements various styles.",womens-watches,129.99,12.6,3.52,12,Fashion Co.,WOM-FAS-WOM-194,1,1 year warranty,Ships in 2 weeks,In Stock,No return policy,5
